ID,Reference,Verse,Notes,NoteFonts,Residue
251,1 Kings 7:34,There were four poles at the four corners of each wagon so-that people could hold it. Hiram made those poles with the wagon in one piece.There were four poles at the four corners of each wagon so that people could hold it. Hiram made those poles and that wagon be one object.~!~(NP there[Existential_Expletive] ) (VP (VP were ) ) (NP (AdjP four ) pole+s[Plural] ) (NP at the[Pre-Nominal] (AdjP four ) corner+s[Plural] (NP of (AdjP each ) wagon ) ) [ so_that (NP people ) (VP could[Pre-Verbal] hold ) (NP it ) ] . (NP Hiram ) (VP made ) (NP those[Pre-Nominal] pole+s[Plural] ) (NP and that[Pre-Nominal] wagon ) [ (NP ) (NP ) (VP be ) (NP (AdjP one ) object ) ] . ,,,
252,1 Kings 7:35,The part of the sides of the holes that had pictures on itself was one quarter meters tall. Hiram attached the sides of the wagon and the poles that held up it to the top of it.At the top of the wagon there was the piece that had the shape of a circle and was one fourth meters tall. Hiram attached the sides of the wagon and the poles that supported it to the top of it.~!~(NP at the[Pre-Nominal] top (NP of the[Pre-Nominal] wagon ) ) (NP there[Existential_Expletive] ) (VP (VP was ) ) (NP the[Pre-Nominal] piece [ that[Relativizer] (NP ) (VP had ) (NP the[Pre-Nominal] shape (NP of a[Pre-Nominal] circle ) ) ] [ and (NP ) (VP was ) (AdjP (NP (AdjP one_fourth ) meter+s[Plural] ) tall ) ] ) . (NP Hiram ) (VP attach+ed[Past_Tense] ) (NP the[Pre-Nominal] side+s[Plural] (NP of the[Pre-Nominal] wagon ) ) (NP and the[Pre-Nominal] pole+s[Plural] [ that[Relativizer] (NP ) (VP support+ed[Past_Tense] ) (NP it ) ] ) (NP to the[Pre-Nominal] top (NP of it ) ) . ,,,
253,1 Kings 7:36,"Hiram cut the bronze sides of the wagons and their bronze posts. He did this thing in order to make pictures of lions, bulls, and angels on those sides and on those posts. These pictures covered the whole wagon. There also were circles of flowers on all of the wagon.Hiram cut the bronze sides of the wagons and the bronze beams of them. He did this to make pictures of lions, bulls, and angels on those sides and on those beams. Those pictures covered the whole wagon. There also were circles of flowers on the whole wagon.~!~(NP Hiram ) (VP cut ) (NP the[Pre-Nominal] (NP _ bronze ) side+s[Plural] (NP of the[Pre-Nominal] wagon+s[Plural] ) ) (NP and the[Pre-Nominal] (NP _ bronze ) beam+s[Plural] (NP of them ) ) . (NP he ) (VP did ) (NP this[Pre-Nominal] ) [ to (NP ) (VP make ) (NP picture+s[Plural] (NP of lion+s[Plural] , ) (NP bull+s[Plural] , ) (NP and angel+s[Plural] ) ) (NP on those[Pre-Nominal] side+s[Plural] ) (NP and on those[Pre-Nominal] beam+s[Plural] ) ] . (NP those[Pre-Nominal] picture+s[Plural] ) (VP covered ) (NP the[Pre-Nominal] (AdjP whole ) wagon ) . (NP there[Existential_Expletive] ) (VP (VP (AdvP also ) were ) ) (NP circle+s[Plural] (NP of flower+s[Plural] ) ) (NP on the[Pre-Nominal] (AdjP whole ) wagon ) . ",,,
254,1 Kings 7:37,Hiram made all the ten wagons by pouring bronze that melted into the same container so-that it would become a wagon.Hiram made all ten of the wagons by pouring bronze that melted into the same container so that it would become a wagon.~!~(NP Hiram ) (VP made ) (NP (AdjP (AdjP all ) ten of ) the[Pre-Nominal] wagon+s[Plural] ) [ by (NP ) (VP pour+ing[Participle] ) (NP bronze [ that[Relativizer] (NP ) (VP melt+ed[Past_Tense] ) ] ) (NP into the[Pre-Nominal] (AdjP same ) container ) [ so_that (NP it ) (VP would[Pre-Verbal] become ) (NP a[Pre-Nominal] wagon ) ] ] . ,,,
255,1 Kings 7:38,Then Hiram made ten very big bronze bowls for the ten wagons. Each bowl was able to contain 900 quarts of water. The distance across each bowl was two meters.Then Hiram made ten very big bronze bowls for the ten wagons. Each bowl was able to contain 900 quarts of water. The distance across each bowl was two meters.~!~then (NP Hiram ) (VP made ) (NP (AdjP ten ) (AdjP very[Pre-Adjective] big ) (NP _ bronze ) bowl+s[Plural] ) (NP for the[Pre-Nominal] (AdjP ten ) wagon+s[Plural] ) . (NP (AdjP each ) bowl ) (VP was ) (AdjP able [ (NP ) (VP to[Pre-Verbal] contain ) (NP (NP (AdjP 900 ) quart+s[Plural] of ) water ) ] ) . (NP the[Pre-Nominal] distance (NP across (AdjP each ) bowl ) ) (VP was ) (NP (AdjP two ) meter+s[Plural] ) . ,,,
256,1 Kings 7:39,Hiram put five of the wagons on the southern side of the temple and put the five other wagons on the northern side. He put the extremely big bowl at the southern and eastern corner of the temple.Hiram put five of the wagons on the southern side of the temple and put the five other wagons on the northern side. He put the extremely big bowl at the southern and eastern corner of the temple.~!~(NP Hiram ) (VP put ) (NP (AdjP five of ) the[Pre-Nominal] wagon+s[Plural] ) (NP on the[Pre-Nominal] (AdjP southern ) side (NP of the[Pre-Nominal] temple ) ) [ and (NP ) (VP put ) (NP the[Pre-Nominal] (AdjP five ) (AdjP other ) wagon+s[Plural] ) (NP on the[Pre-Nominal] (AdjP northern ) side ) ] . (NP he ) (VP put ) (NP the[Pre-Nominal] (AdjP extremely[Pre-Adjective] big ) bowl ) (NP at the[Pre-Nominal] (AdjP southern ) (AdjP and eastern ) corner (NP of the[Pre-Nominal] temple ) ) . ,,,
257,1 Kings 7:40,"Hiram also made pots, tools that people used in order to dig holes, and small bowls. So he finished making for the temple of Yahweh all of the things that King Solomon wanted.Hiram also made pots, tools that people used to dig holes, and small bowls. So he finished making for the LORD's temple all of the things that King Solomon wanted.~!~(NP Hiram ) (VP (AdvP also ) made ) (NP pot+s[Plural] , ) (NP tool+s[Plural] [ that[Relativizer] (NP people ) (VP us+ed[Past_Tense] ) (NP ) [ to (NP ) (VP dig ) (NP hole+s[Plural] ) ] ] , ) (NP and (AdjP small ) bowl+s[Plural] ) . so (NP he ) (VP finished[Pre-Verbal] mak+ing[Participle] ) (NP for (NP _ the[Pre-Nominal] LORD+`s[Saxon_Genitive] ) temple ) (NP (AdjP all of ) the[Pre-Nominal] thing+s[Plural] [ that[Relativizer] (NP (NP _ King ) Solomon ) (VP want+ed[Past_Tense] ) (NP ) ] ) . ",,,
258,1 Kings 7:41,"Hiram made the two pillars, the two bowls that were for the tops of the pillars, and the chain groups that covered the tops of the pillars.Hiram made the two pillars, the two bowls that were for the tops of the pillars, and the chain groups that covered the tops of the pillars.~!~(NP Hiram ) (VP made ) (NP the[Pre-Nominal] (AdjP two ) pillar+s[Plural] , ) (NP the[Pre-Nominal] (AdjP two ) bowl+s[Plural] [ that[Relativizer] (NP ) (VP were ) (NP for the[Pre-Nominal] top+s[Plural] (NP of the[Pre-Nominal] pillar+s[Plural] ) ) ] , ) (NP and the[Pre-Nominal] (NP _ chain ) group+s[Plural] [ that[Relativizer] (NP ) (VP covered ) (NP the[Pre-Nominal] top+s[Plural] (NP of the[Pre-Nominal] pillar+s[Plural] ) ) ] ) . ",,,
259,1 Kings 7:42,"And Hiram made the 400 pomegranates for the two groups of chains. For each chain group that covered the bowls that were on top of the pillars, there were two horizontal lines of pomegranates.And Hiram made the 400 <<bronze>> pomegranates for the two groups of chains. For each chain group that covered the bowls that were on top of the pillars, there were two rows of <<bronze>> pomegranates.~!~and (NP Hiram ) (VP made ) (NP the[Pre-Nominal] (AdjP 400 ) (NP <<[Opening_Implicit_Marker] _ bronze >>[Closing_Implicit_Marker] ) pomegranate+s[Plural] ) (NP for (NP the[Pre-Nominal] (AdjP two ) group+s[Plural] of ) chain+s[Plural] ) . (NP for (AdjP each ) (NP _ chain ) group [ that[Relativizer] (NP ) (VP covered ) (NP the[Pre-Nominal] bowl+s[Plural] [ that[Relativizer] (NP ) (VP were ) (NP on top (NP of the[Pre-Nominal] pillar+s[Plural] ) ) ] ) ] , ) (NP there[Existential_Expletive] ) (VP (VP were ) ) (NP (AdjP two ) row+s[Plural] (NP of (NP <<[Opening_Implicit_Marker] _ bronze >>[Closing_Implicit_Marker] ) pomegranate+s[Plural] ) ) . ",,,
260,1 Kings 7:43,And Hiram made the ten wagons with their ten very big bowls.And Hiram made the ten wagons with the ten very big bowls of them.~!~and (NP Hiram ) (VP made ) (NP the[Pre-Nominal] (AdjP ten ) wagon+s[Plural] ) (NP with the[Pre-Nominal] (AdjP ten ) (AdjP very[Pre-Adjective] big ) bowl+s[Plural] (NP of them ) ) . ,,,
261,1 Kings 7:44,And Hiram made the extremely big bowl and the twelve bronze bulls that were under it.And Hiram made the extremely big bowl and the twelve bronze bulls that were under it.~!~and (NP Hiram ) (VP made ) (NP the[Pre-Nominal] (AdjP extremely[Pre-Adjective] big ) bowl ) (NP and the[Pre-Nominal] (AdjP twelve ) (NP _ bronze ) bull+s[Plural] [ that[Relativizer] (NP ) (VP were ) (NP under it ) ] ) . ,,,
262,1 Kings 7:45,"And Hiram made the pots, the tools that people used in order to dig holes, and the small bowls. He made all of these things from shiny bronze for King Solomon who wanted them for the temple of Yahweh.And Hiram made the pots, the tools that people used to dig holes, and the small bowls. He made all of these things for King Solomon, who wanted them for the LORD's temple, from shiny bronze.~!~and (NP Hiram ) (VP made ) (NP the[Pre-Nominal] pot+s[Plural] , ) (NP the[Pre-Nominal] tool+s[Plural] [ that[Relativizer] (NP people ) (VP us+ed[Past_Tense] ) (NP ) [ to (NP ) (VP dig ) (NP hole+s[Plural] ) ] ] , ) (NP and the[Pre-Nominal] (AdjP small ) bowl+s[Plural] ) . (NP he ) (VP made ) (NP (AdjP all of ) these[Pre-Nominal] thing+s[Plural] ) (NP for (NP _ King ) Solomon [ , (NP who ) (NP (NP ) ) (VP want+ed[Past_Tense] ) (NP them ) (NP for (NP _ the[Pre-Nominal] LORD+`s[Saxon_Genitive] ) temple ) , ] ) (NP from (AdjP shiny ) bronze ) . ",,,
263,1 Kings 7:46,The king ordered Hiram to make these things by pouring bronze that melted into clay containers. Hiram did this thing in the plain of river Jordan between Succoth and Zarethan.The king ordered Hiram to make these things by pouring bronze that melted into clay containers. Hiram did this in the plain of the Jordan River between Succoth and Zarethan.~!~(NP the[Pre-Nominal] king ) (VP ordered ) (NP Hiram ) [ (NP ) (VP to[Pre-Verbal] make ) (NP these[Pre-Nominal] thing+s[Plural] ) [ by (NP ) (VP pour+ing[Participle] ) (NP bronze [ that[Relativizer] (NP ) (VP melt+ed[Past_Tense] ) ] ) (NP into (NP _ clay ) container+s[Plural] ) ] ] . (NP Hiram ) (VP did ) (NP this[Pre-Nominal] ) (NP in the[Pre-Nominal] plain (NP of the[Pre-Nominal] Jordan[First_Word_of_Compound_Noun] River ) ) (NP between Succoth ) (NP and Zarethan ) . ,,,
264,1 Kings 7:47,Solomon didn't weigh any of those things because they were very many. So no person even tried to weigh the bronze.Solomon didn't weigh any of those things because they were very many. So no person even tried to weigh the bronze.~!~(NP Solomon ) (VP didn`t[Pre-Verbal] weigh ) (NP (AdjP any of ) those[Pre-Nominal] thing+s[Plural] ) [ because (NP they ) (VP were ) (AdjP very[Pre-Adjective] many ) ] . so (NP no[Pre-Nominal] person ) (VP (AdvP even ) tr+ied[Past_Tense] ) [ (NP ) (VP to[Pre-Verbal] weigh ) (NP the[Pre-Nominal] bronze ) ] . ,,,
265,1 Kings 7:48,Solomon also ordered his servants to make many things for the temple from gold. Solomon's servants made the gold altar and the gold table for the holy bread.Solomon's servants also made many things for the temple from gold. They made the gold altar and the gold table for the holy bread.~!~(NP (NP _ Solomon+`s[Saxon_Genitive] ) servant+s[Plural] ) (VP (AdvP also ) made ) (NP (AdjP many ) thing+s[Plural] ) (NP for the[Pre-Nominal] temple ) (NP from gold ) . (NP they ) (VP made ) (NP the[Pre-Nominal] (NP _ gold ) altar ) (NP and the[Pre-Nominal] (NP _ gold ) table ) (NP for the[Pre-Nominal] (AdjP holy ) bread ) . ,,,
266,1 Kings 7:49,"Solomon made the pure gold objects for the lamps. He put five of those objects on the right side and put five of them on the left side in front of the holiest room. He also made the gold flowers, gold lamps, and gold tools that people used in order to grab things.Solomon made the pure gold objects for the lamps. He put five of those objects on the right side and put five of them on the left side in front of the holiest room. He also made the gold flowers, gold lamps, and gold tools that people used to grab things.~!~(NP Solomon ) (VP made ) (NP the[Pre-Nominal] (NP _ (AdjP pure ) gold ) object+s[Plural] ) (NP for the[Pre-Nominal] lamp+s[Plural] ) . (NP he ) (VP put ) (NP (AdjP five of ) those[Pre-Nominal] object+s[Plural] ) (NP on the[Pre-Nominal] (AdjP right ) side ) [ and (NP ) (VP put ) (NP (AdjP five of ) them ) (NP on the[Pre-Nominal] (AdjP left ) side (NP in_front_of the[Pre-Nominal] (AdjP holi+est[Superlative] ) room ) ) ] . (NP he ) (VP (AdvP also ) made ) (NP the[Pre-Nominal] (NP _ gold ) flower+s[Plural] , ) (NP (NP _ gold ) lamp+s[Plural] , ) (NP and (NP _ gold ) tool+s[Plural] [ that[Relativizer] (NP people ) (VP us+ed[Past_Tense] ) (NP ) [ to (NP ) (VP grab ) (NP thing+s[Plural] ) ] ] ) . ",,,
267,1 Kings 7:50,Solomon made bowls and made tools that people used in order to prevent a candle from burning. He made small bowls and made plates for a substance that smelled good. He made plates so-that people could carry fire in them. And he made for the holiest room and the big room of the temple things that people attached to doors and walls in order to hold up those doors. He made all of these things from pure gold.Solomon made bowls and made tools that people used to prevent a candle from burning. He made small bowls and made plates for an incense that smelled good. He made plates so that people could carry fire in them. And he made for the holiest room and the big room of the temple things that people attached to doors and walls to support those doors. He made all of these things from pure gold.~!~(NP Solomon ) (VP made ) (NP bowl+s[Plural] ) [ and (NP ) (VP made ) (NP tool+s[Plural] [ that[Relativizer] (NP people ) (VP us+ed[Past_Tense] ) (NP ) [ to (NP ) (VP prevent ) (NP a[Pre-Nominal] candle ) [ from[Complementizer] (NP ) (VP burn+ing[Participle] ) ] ] ] ) ] . (NP he ) (VP made ) (NP (AdjP small ) bowl+s[Plural] ) [ and (NP ) (VP made ) (NP plate+s[Plural] ) (NP for an[Pre-Nominal] incense [ that[Relativizer] (NP ) (VP smell+ed[Past_Tense] ) (AdjP good ) ] ) ] . (NP he ) (VP made ) (NP plate+s[Plural] ) [ so_that (NP people ) (VP could[Pre-Verbal] carry ) (NP fire ) (NP in them ) ] . and (NP he ) (VP made ) (NP for the[Pre-Nominal] (AdjP holi+est[Superlative] ) room ) (NP and the[Pre-Nominal] (AdjP big ) room (NP of the[Pre-Nominal] temple ) ) (NP thing+s[Plural] [ that[Relativizer] (NP people ) (VP attach+ed[Past_Tense] ) (NP ) (NP to door+s[Plural] ) (NP and wall+s[Plural] ) [ to (NP ) (VP support ) (NP those[Pre-Nominal] door+s[Plural] ) ] ] ) . (NP he ) (VP made ) (NP (AdjP all of ) these[Pre-Nominal] thing+s[Plural] ) (NP from (AdjP pure ) gold ) . ,,,
268,1 Kings 7:51,"And so Solomon finished doing all of the work to the temple of Yahweh. David who was Solomon's father had kept silver, gold, and other things for the temple of Yahweh. So Solomon brought these things to the temple and put them into its treasuries.And so Solomon finished doing all of the work to the LORD's temple. David, who was Solomon's father, had kept silver, gold, and other things for the LORD's temple. So Solomon brought these things to the temple and put them into the treasuries of the temple.~!~and_so (NP Solomon ) (VP finished[Pre-Verbal] do+ing[Participle] ) (NP (AdjP all of ) the[Pre-Nominal] work ) (NP to (NP _ the[Pre-Nominal] LORD+`s[Saxon_Genitive] ) temple ) . (NP David [ , (NP who ) (NP (NP ) ) (VP was ) (NP (NP _ Solomon+`s[Saxon_Genitive] ) father ) , ] ) (VP had[Pre-Verbal] kept ) (NP silver , ) (NP gold , ) (NP and (AdjP other ) thing+s[Plural] ) (NP for (NP _ the[Pre-Nominal] LORD+`s[Saxon_Genitive] ) temple ) . so (NP Solomon ) (VP brought ) (NP these[Pre-Nominal] thing+s[Plural] ) (NP to the[Pre-Nominal] temple ) [ and (NP ) (VP put ) (NP them ) (NP into the[Pre-Nominal] treasuri+es[Plural] (NP of the[Pre-Nominal] temple ) ) ] . ",,,
269,1 Kings 8:1,"Title: King Solomon brings the ark of the covenant to the temple. Then Solomon called all of the elders of Israel and told them to come to him in Jerusalem. The elders included all of the leaders of the tribes and also included the chiefs of the families of Israel. Solomon wanted the elders to bring the ark of the covenant of Yahweh from Zion, which was the city of David, to the temple.Title: King Solomon brings the ark of the covenant to the temple. Then Solomon called all of the elders of Israel and told them to come to him in Jerusalem. The elders included all of the leaders of the tribes and also included the chiefs of the families of Israel. Solomon wanted the elders to bring the LORD's ark of the covenant from Zion, which was in David's city, to the temple.~!~Title:[Proposition_Label] (NP (NP _ King ) Solomon ) (VP bring+s[Third_Singular_Present] ) (NP the[Pre-Nominal] ark_of_the_covenant ) (NP to the[Pre-Nominal] temple ) . then (NP Solomon ) (VP call+ed[Past_Tense] ) (NP (AdjP all of ) the[Pre-Nominal] elder+s[Plural] (NP of Israel ) ) [ and (NP ) (VP told ) (NP them ) [ (NP ) (VP to[Pre-Verbal] come ) (NP to him ) (NP in Jerusalem ) ] ] . (NP the[Pre-Nominal] elder+s[Plural] ) (VP includ+ed[Past_Tense] ) (NP (AdjP all of ) the[Pre-Nominal] leader+s[Plural] (NP of the[Pre-Nominal] tribe+s[Plural] ) ) [ and (NP ) (VP (AdvP also ) includ+ed[Past_Tense] ) (NP the[Pre-Nominal] chief+s[Plural] (NP of the[Pre-Nominal] famili+es[Plural] (NP of Israel ) ) ) ] . (NP Solomon ) (VP want+ed[Past_Tense] ) (NP the[Pre-Nominal] elder+s[Plural] ) [ (NP ) (VP to[Pre-Verbal] bring ) (NP (NP _ the[Pre-Nominal] LORD+`s[Saxon_Genitive] ) ark_of_the_covenant ) (NP from Zion [ , (NP which ) (NP (NP ) ) (VP was ) (NP in (NP _ David+`s[Saxon_Genitive] ) city ) , ] ) (NP to the[Pre-Nominal] temple ) ] . ",,,
270,1 Kings 8:2,"All of the Israelites gathered at the place where King Solomon was in order to celebrate the Feast of Booths. The Feast of Booths was in the month named Ethanim, which was the seventh month.All of the Israelites gathered at the place where King Solomon was to celebrate the Feast of Booths. The Feast of Booths was in the month named Ethanim, which was the seventh month.~!~(NP (AdjP all of ) the[Pre-Nominal] Israelite+s[Plural] ) (VP gathered ) (NP at the[Pre-Nominal] place [ where[Relativizer] (NP (NP _ King ) Solomon ) (VP was ) (NP ) ] ) [ to (NP ) (VP celebrate ) (NP the[Pre-Nominal] Feast_of_Booths ) ] . (NP the[Pre-Nominal] Feast_of_Booths ) (VP was ) (NP in the[Pre-Nominal] month (NP named Ethanim [ , (NP which ) (NP (NP ) ) (VP was ) (NP the[Pre-Nominal] (AdjP seventh ) month ) , ] ) ) . ",,,
271,1 Kings 8:3,All of the elders of Israel arrived at the place where Solomon was. Then the priests picked the ark of the covenant up and carried it.All of the elders of Israel arrived at at the place where Solomon was. Then the priests picked up the ark of the covenant and carried it.~!~(NP (AdjP all of ) the[Pre-Nominal] elder+s[Plural] (NP of Israel ) ) (VP arriv+ed[Past_Tense] ) (NP at at the[Pre-Nominal] place [ where[Relativizer] (NP Solomon ) (VP was ) (NP ) ] ) . then (NP the[Pre-Nominal] priest+s[Plural] ) (VP pick+ed[Past_Tense] up[Adposition_in_VP] ) (NP the[Pre-Nominal] ark_of_the_covenant ) [ and (NP ) (VP carr+ied[Past_Tense] ) (NP it ) ] . ,,,
272,1 Kings 8:4,The priests brought the ark of the covenant. They also brought the tabernacle and all of the special things that were in there. The priests and Levites carried all of those things to the temple.The priests brought the ark of the covenant. They also brought the tabernacle and all of the holy things that were in there. The priests and the Levites carried all of those things to the temple.~!~(NP the[Pre-Nominal] priest+s[Plural] ) (VP brought ) (NP the[Pre-Nominal] ark_of_the_covenant ) . (NP they ) (VP (AdvP also ) brought ) (NP the[Pre-Nominal] tabernacle ) (NP and (AdjP all of ) the[Pre-Nominal] (AdjP holy ) thing+s[Plural] [ that[Relativizer] (NP ) (VP were ) (NP in there ) ] ) . (NP the[Pre-Nominal] priest+s[Plural] ) (NP and the[Pre-Nominal] Levite+s[Plural] ) (VP carr+ied[Past_Tense] ) (NP (AdjP all of ) those[Pre-Nominal] thing+s[Plural] ) (NP to the[Pre-Nominal] temple ) . ,,,
273,1 Kings 8:5,All of the people of Israel gathered around King Solomon. All of them were in front of the ark of the covenant. They sacrificed very many sheep and very many cattle to God. They were not able to count those animals because they were too many.All of the Israelites gathered around King Solomon. All of them were in front of the ark of the covenant. They sacrificed very many sheep and very many cattle to God. They weren't able to count those animals because they were too many.~!~(NP (AdjP all of ) the[Pre-Nominal] Israelite+s[Plural] ) (VP gathered ) (NP around (NP _ King ) Solomon ) . (NP (AdjP all of ) they ) (VP were ) (NP in_front_of the[Pre-Nominal] ark_of_the_covenant ) . (NP they ) (VP sacrific+ed[Past_Tense] ) (NP (AdjP very[Pre-Adjective] many ) sheep ) (NP and (AdjP very[Pre-Adjective] many ) cattle ) (NP to God ) . (NP they ) (VP were not[Post-Verbal] ) (AdjP able [ (NP ) (VP to[Pre-Verbal] count ) (NP those[Pre-Nominal] animal+s[Plural] ) ] ) [ because (NP they ) (VP were ) (AdjP too[Pre-Adjective] many ) ] . ,,,
274,1 Kings 8:6,"The priests brought the ark of the covenant of Yahweh to its place, which was in the Most Holy Place the temple. They put the ark of the covenant under the wings of the statues that looked like cherubim.The priests brought the LORD's ark of the covenant to its place, which was in the Most Holy Place of the temple. They put the ark of the covenant under the wings of the statues that looked like cherubim.~!~(NP the[Pre-Nominal] priest+s[Plural] ) (VP brought ) (NP (NP _ the[Pre-Nominal] LORD+`s[Saxon_Genitive] ) ark_of_the_covenant ) (NP to (NP _ its ) place [ , (NP which ) (NP (NP ) ) (VP was ) (NP in the[Pre-Nominal] Most_Holy_Place (NP of the[Pre-Nominal] temple ) ) , ] ) . (NP they ) (VP put ) (NP the[Pre-Nominal] ark_of_the_covenant ) (NP under the[Pre-Nominal] wing+s[Plural] (NP of the[Pre-Nominal] statue+s[Plural] [ that[Relativizer] (NP ) (VP look+ed[Past_Tense] like[Adposition_in_VP] ) (NP cherubim ) ] ) ) . ",,,
275,1 Kings 8:7,The angels' wings were wide. The angels' wings were over the place where the ark of the covenant was. The wings covered the ark of the covenant. The wings also covered the poles that the priests used in order to carry the ark of the covenant.The angels' wings were wide. The angels' wings were over the place where the ark of the covenant was. The wings covered the ark of the covenant. The wings also covered the poles that the priests used to carry the ark of the covenant.~!~(NP (NP _ the[Pre-Nominal] angel+s[Plural]+~[Saxon_Genitive] ) wing+s[Plural] ) (VP were ) (AdjP wide ) . (NP (NP _ the[Pre-Nominal] angel+s[Plural]+~[Saxon_Genitive] ) wing+s[Plural] ) (VP were ) (NP over the[Pre-Nominal] place [ where[Relativizer] (NP the[Pre-Nominal] ark_of_the_covenant ) (VP was ) (NP ) ] ) . (NP the[Pre-Nominal] wing+s[Plural] ) (VP covered ) (NP the[Pre-Nominal] ark_of_the_covenant ) . (NP the[Pre-Nominal] wing+s[Plural] ) (VP (AdvP also ) covered ) (NP the[Pre-Nominal] pole+s[Plural] [ that[Relativizer] (NP the[Pre-Nominal] priest+s[Plural] ) (VP us+ed[Past_Tense] ) (NP ) [ to (NP ) (VP carry ) (NP the[Pre-Nominal] ark_of_the_covenant ) ] ] ) . ,,,
276,1 Kings 8:8,"The poles were very long. If a person were in the Holy Place, which is in front of the Most Holy Place, he would be able to see the ends of the poles. But if a person were outside the Holy Place, he would be able to see the ends of the poles. And today those poles still are there.The poles were very long. If a person were in the Holy Place, which is in front of the Most Holy Place, he would be able to see the ends of the poles. But if a person were outside the Holy Place, he wouldn't be able to see the ends of the poles. And today those poles still are there.~!~(NP the[Pre-Nominal] pole+s[Plural] ) (VP were ) (AdjP very[Pre-Adjective] long ) . [ if (NP a[Pre-Nominal] person ) (VP were ) (NP in the[Pre-Nominal] Holy_Place [ , (NP which ) (NP (NP ) ) (VP is ) (NP in_front_of the[Pre-Nominal] Most_Holy_Place ) , ] ) , ] (NP he ) (VP would[Pre-Verbal] be ) (AdjP able [ (NP ) (VP to[Pre-Verbal] see ) (NP the[Pre-Nominal] end+s[Plural] (NP of the[Pre-Nominal] pole+s[Plural] ) ) ] ) . but [ if (NP a[Pre-Nominal] person ) (VP were ) (NP outside the[Pre-Nominal] Holy_Place ) , ] (NP he ) (VP wouldn`t[Pre-Verbal] be ) (AdjP able [ (NP ) (VP to[Pre-Verbal] see ) (NP the[Pre-Nominal] end+s[Plural] (NP of the[Pre-Nominal] pole+s[Plural] ) ) ] ) . and (AdvP today ) (NP those[Pre-Nominal] pole+s[Plural] ) (VP (AdvP still ) are ) (NP there ) . ",,,
