ID,Reference,Verse,Notes,NoteFonts,Residue
139,Ephesians 6:8,"Slaves, I want you to know that each person who does a good thing will receive a reward from God. If that person is a slave, he'll receive that reward. And if that person isn't a slave, he'll receive that reward.~!~(NP slave+s[Plural] , ) (NP I ) (VP want ) (NP you ) [ (NP ) (VP to[Pre-Verbal] know ) [ that[Complementizer] (NP (AdjP each ) person [ who[Relativizer] (NP ) (VP does ) (NP a[Article] (AdjP good ) thing ) ] ) (VP will[Pre-Verbal] receive ) (NP a[Article] reward ) (NP from God ) ] ] . [ if (NP that[Proximity] person ) (VP is ) (NP a[Article] slave ) , ] (NP he ) (VP will[Pre-Verbal] receive ) (NP that[Proximity] reward ) . and [ if (NP that[Proximity] person ) (VP isn`t ) (NP a[Article] slave ) , ] (NP he ) (VP will[Pre-Verbal] receive ) (NP that[Proximity] reward ) . ",,,
110,Ephesians 5:12,People who talk about the bad things that they do when people aren't watching them should be ashamed.~!~(NP people [ who[Relativizer] (NP ) (VP talk ) (NP about the[Pre-Nominal] (AdjP bad ) thing+s[Plural] [ that[Relativizer] (NP they ) (VP do ) (NP ) [ when (NP people ) (VP aren`t[Pre-Verbal] watch+ing[Participle] ) (NP them ) ] ] ) ] ) (VP should[Pre-Verbal] be ) (AdjP ashamed ) . ,,,
7,Ephesians 1:7,"God released us from death and sin because he united us with Christ. God released us from death and sin by forgiving the bad things that we did. He forgave us because when Christ died on the cross, he gave his blood to him. And God forgave us because he is extremely kind.~!~(NP God ) (VP releas+ed[Past_Tense] ) (NP us ) (NP from death ) (NP and sin ) [ because (NP he ) (VP unit+ed[Past_Tense] ) (NP us ) (NP with Christ ) ] . (NP God ) (VP releas+ed[Past_Tense] ) (NP us ) (NP from death ) (NP and sin ) [ by (NP ) (VP forgiv+ing[Participle] ) (NP the[Pre-Nominal] (AdjP bad ) thing+s[Plural] [ that[Relativizer] (NP we ) (VP did ) (NP ) ] ) ] . (NP he ) (VP forgave ) (NP us ) [ because [ when (NP Christ ) (VP di+ed[Past_Tense] ) (NP on the[Pre-Nominal] cross ) , ] (NP he ) (VP gave ) (NP (NP _ his ) blood ) (NP to him ) ] . and (NP God ) (VP forgave ) (NP us ) [ because (NP he ) (VP is ) (AdjP extremely[Pre-Adjective] kind ) ] . ",,,
73,Ephesians 4:7,God wants each of us to do certain things for him. And Christ causes each of us to be able to do those things.~!~(NP God ) (VP want+s[Third_Singular_Present] ) (NP (AdjP each of ) us ) [ (NP ) (VP to[Pre-Verbal] do ) (NP (AdjP certain ) thing+s[Plural] ) (NP for him ) ] . and (NP Christ ) (VP cause+s[Third_Singular_Present] ) (NP (AdjP each of ) us ) [ (NP ) (VP to[Pre-Verbal] be ) (AdjP able [ (NP ) (VP to[Pre-Verbal] do ) (NP those[Pre-Nominal] thing+s[Plural] ) ] ) ] . ,,,
35,Ephesians 2:12,At that time you didn't know Christ. You were not Israelites. God didn't promise you that he would do for you the things that he promised his people that he would do for them. And you were not able to hope that God will bless you. You lived on the earth without God.~!~at_that_time (NP you ) (VP didn`t[Pre-Verbal] know ) (NP Christ ) . (NP you ) (VP were not[Post-Verbal] ) (NP Israelite+s[Plural] ) . (NP God ) (VP didn`t[Pre-Verbal] promise ) (NP you ) [ that[Complementizer] (NP he ) (VP would[Pre-Verbal] do ) (NP for you ) (NP the[Pre-Nominal] thing+s[Plural] [ that[Relativizer] (NP he ) (VP promis+ed[Past_Tense] ) (NP (NP _ his ) people ) [ that[Complementizer] (NP he ) (VP would[Pre-Verbal] do ) (NP ) (NP for them ) ] ] ) ] . and (NP you ) (VP were not[Post-Verbal] ) (AdjP able [ (NP ) (VP to[Pre-Verbal] hope ) [ that[Complementizer] (NP God ) (VP will[Pre-Verbal] bless ) (NP you ) ] ] ) . (NP you ) (VP liv+ed[Past_Tense] ) (NP on the[Pre-Nominal] earth (NP without God ) ) . ,,,
