ID,Reference,Verse,Notes,NoteFonts,Residue
1,Colossians 1:1,I'm Paul. God chose me to be an apostle of Jesus Christ. And Timothy is my friend who believes in Jesus.~!~(NP I ) (VP am ) (NP Paul ) . (NP God ) (VP chose ) (NP me ) [ (NP ) (VP to[Pre-Verbal] be ) (NP an[Pre-Nominal] apostle (NP of _ Jesus (NP _ Christ ) ) ) ] . and (NP Timothy ) (VP is ) (NP (NP _ my ) friend [ who[Relativizer] (NP ) (VP believe+s[Third_Singular_Present] ) (NP in Jesus ) ] ) . ,,,
2,Colossians 1:2,"We are writing this letter to God's people who are in Colosse. And we are writing this letter to our faithful friends who believe in Christ and belong to him. We ask God, who is our Father, to treat you kindly. And we ask God to help you be peaceful.~!~(NP we ) (VP are writ+ing[Participle] ) (NP this[Proximity] letter ) (NP to (NP _ God+`s[Saxon_Genitive] ) people [ who[Relativizer] (NP ) (VP are ) (NP in Colosse ) ] ) . and (NP we ) (VP are writ+ing[Participle] ) (NP this[Proximity] letter ) (NP to (NP _ our ) (AdjP faithful ) friend+s[Plural] [ who[Relativizer] (NP ) (VP believe ) (NP in Christ ) ] [ and (NP ) (VP belong ) (NP to him ) ] ) . (NP we ) (VP ask ) (NP God [ , (NP who ) (NP ) (VP is ) (NP (NP _ our ) Father ) , ] ) [ (NP ) (VP to[INFL] treat ) (NP you ) (AdvP kindly ) ] . and (NP we ) (VP ask ) (NP God ) [ (NP ) (VP to[INFL] help ) (NP you ) [ (NP ) (VP be ) (AdjP peaceful ) ] ] . ",,,
3,Colossians 1:3,"We are always praying for you. And when we pray for you, we thank God. God is the father of our Lord, who is Jesus Christ.~!~(NP we ) (VP are[Pre-Verbal] (AdvP always ) pray+ing[Participle] ) (NP for you ) . and [ when (NP we ) (VP pray ) (NP for you ) , ] (NP we ) (VP thank ) (NP God ) . (NP God ) (VP is ) (NP the[Article] father (NP of _ (NP _ our ) Lord [ , (NP who ) (NP ) (VP is ) (NP Jesus (NP _ Christ ) ) , ] ) ) . ",,,
5,Colossians 1:5,"You do these things because you expect God to do wonderful things for you. And God will certainly do these wonderful things for you. When you heard God's good message, you learned about these things. And God's message is the true message.",,,
6,Colossians 1:6,People who live in many other places that are on the earth also heard God's good message. More people are believing God's good message there. And more people are living there like God wants them to live. These things are also happening among you since you heard God's good message. And you truly understand that God treats us kindly since you heard his good message.~!~(NP people [ who[Relativizer] (NP ) (VP live ) (NP in (AdjP many ) (AdjP other ) place+s[Plural] [ that[Relativizer] (NP ) (VP are ) (NP on the[Article] earth ) ] ) ] (AdvP also ) ) (VP heard ) (NP (NP _ God+`s[Saxon_Genitive] ) (AdjP good ) message ) . (NP (AdjP more ) people ) (VP are[Pre-Verbal] believ+ing[Participle] ) (NP (NP _ God+`s[Saxon_Genitive] ) (AdjP good ) message ) (NP there ) . and (NP (AdjP more ) people ) (VP are[Pre-Verbal] liv+ing[Participle] ) (NP there ) [ like (NP God ) (VP want+s[Third_Singular_Present] ) (NP them ) [ (NP ) (VP to[Pre-Verbal] live ) ] ] . (NP these[Proximity] thing+s[Plural] ) (VP are[Pre-Verbal] (AdvP also ) happening ) (NP among you ) [ since (NP you ) (VP heard ) (NP (NP _ God+`s[Saxon_Genitive] ) (AdjP good ) message ) ] . and (NP you ) (VP (AdvP truly ) understand ) [ that[Complementizer] (NP God ) (VP treat+s[Third_Singular_Present] ) (NP us ) (AdvP kindly ) ] [ since (NP you ) (VP heard ) (NP (NP _ his ) (AdjP good ) message ) ] . ,,,
7,Colossians 1:7,"You heard about these things from Epaphras, whom we love. Epaphras faithfully serves Christ with us. Epaphras is our representative for you.",,,
8,Colossians 1:8,And Epaphras told us that the Holy Spirit caused you to love other Christians greatly.,,,
10,Colossians 1:10,We pray to God about these things so that you could live like you should live. Then you'll completely please God. You'll do many good things and learn new things that are about God.~!~(NP we ) (VP pray ) (NP to God ) (NP about these[Proximity] thing+s[Plural] ) [ so_that (NP you ) (VP could[Mood] live ) [ like (NP you ) (VP should[Mood] live ) ] ] . then (NP you ) (VP will[INFL] (AdvP completely ) please ) (NP God ) . (NP you ) (VP will[INFL] do ) (NP (AdjP many ) (AdjP good ) thing+s[Plural] ) [ and (NP ) (VP learn ) (NP (AdjP new ) thing+s[Plural] [ that[Relativizer] (NP ) (VP are ) (NP about God ) ] ) ] . ,,,
11,Colossians 1:11,"We pray that God, who is extremely powerful, will cause you to be faithful, patient, and happy.",,,
12,Colossians 1:12,And we pray that you'll thank the Father. The Father caused you to be able to live in heaven with him forever.~!~and (NP we ) (VP pray ) [ that[Complementizer] (NP you ) (VP will[INFL] thank ) (NP the[Article] Father ) ] . (NP the[Article] Father ) (VP caus+ed[Past_Tense] ) (NP you ) [ (NP ) (VP to[INFL] be ) (AdjP able [ (NP ) (VP to[INFL] live ) (NP in heaven ) (NP with him ) (AdvP forever ) ] ) ] . ,,,
13,Colossians 1:13,"Title: Jesus Christ is greater than all things. Earlier Satan and demons ruled us. But the Father saved us from Satan and demons. And the Son, whom the Father loves, rules us now.~!~Title:[Proposition_Label] (NP Jesus (NP _ Christ ) ) (VP is ) (AdjP great+er[Comparative] (NP than[Comparison_Marker] (AdjP all ) thing+s[Plural] ) ) . (AdvP earlier ) (NP Satan ) (NP and demon+s[Plural] ) (VP rul+ed[Past_Tense] ) (NP us ) . but (NP the[Article] Father ) (VP sav+ed[Past_Tense] ) (NP us ) (NP from Satan ) (NP and demon+s[Plural] ) . and (NP the[Article] Son [ , (NP whom ) (NP the[Article] Father ) (VP love+s[Third_Singular_Present] ) (NP ) , ] ) (VP rule+s[Third_Singular_Present] ) (NP us ) (AdvP now ) . ",,,
14,Colossians 1:14,The Father released us from sin and death through the Son and forgave through him the bad things that we did.~!~(NP the[Pre-Nominal] Father ) (VP releas+ed[Past_Tense] ) (NP us ) (NP from sin ) (NP and death ) (NP through the[Pre-Nominal] Son ) [ and (NP ) (VP forgave ) (NP through him ) (NP the[Pre-Nominal] (AdjP bad ) thing+s[Plural] [ that[Relativizer] (NP we ) (VP did ) (NP ) ] ) ] . ,,,
16,Colossians 1:16,"God created all things through the Son. These things that God created include things that are in heaven, things that are on the earth, things that people are able to see, and things that people aren't able to see. These things include angels who rule other angels, demons who rule other demons, angels who are powerful, demons who are powerful, angels who have authority, and demons who have authority.~!~(NP God ) (VP creat+ed[Past_Tense] ) (NP (AdjP all ) thing+s[Plural] ) (NP through the[Article] Son ) . (NP these[Proximity] thing+s[Plural] [ that[Relativizer] (NP God ) (VP creat+ed[Past_Tense] ) (NP ) ] ) (VP include ) (NP thing+s[Plural] [ that[Relativizer] (NP ) (VP are ) (NP in heaven ) ] , ) (NP thing+s[Plural] [ that[Relativizer] (NP ) (VP are ) (NP on the[Article] earth ) ] , ) (NP thing+s[Plural] [ that[Relativizer] (NP people ) (VP are ) (AdjP able [ (NP ) (VP to[Pre-Verbal] see ) (NP ) ] ) ] , ) (NP and thing+s[Plural] [ that[Relativizer] (NP people ) (VP aren`t ) (AdjP able [ (NP ) (VP to[Pre-Verbal] see ) (NP ) ] ) ] ) . (NP these[Proximity] thing+s[Plural] ) (VP include ) (NP angel+s[Plural] [ who[Relativizer] (NP ) (VP rule ) (NP (AdjP other ) angel+s[Plural] ) ] , ) (NP demon+s[Plural] [ who[Relativizer] (NP ) (VP rule ) (NP (AdjP other ) demon+s[Plural] ) ] , ) (NP angel+s[Plural] [ who[Relativizer] (NP ) (VP are ) (AdjP powerful ) ] , ) (NP demon+s[Plural] [ who[Relativizer] (NP ) (VP are ) (AdjP powerful ) ] , ) (NP angel+s[Plural] [ who[Relativizer] (NP ) (VP have ) (NP authority ) ] , ) (NP and demon+s[Plural] [ who[Relativizer] (NP ) (VP have ) (NP authority ) ] ) . ",,,
17,Colossians 1:17,"Before all of these things that God created existed, the Son existed. And all of these things exist because of the Son.",,,
18,Colossians 1:18,The Son leads all Christians like the head leads all of the body's other parts. We live because of the Son. The Son is the first person that God caused to become alive again. So the Son will live with God forever. God will cause many people to become alive again. But the Son is the most important person that God will cause to become alive again. Primary: God caused the Son to become alive again so that he could rule all things. Alternate 1: God caused the Son to become alive again so that he could be more important than all things.~!~(NP the[Article] Son ) (VP lead+s[Third_Singular_Present] ) (NP (AdjP all ) Christian+s[Plural] ) [ like (NP the[Article] head ) (VP lead+s[Third_Singular_Present] ) (NP (AdjP all of ) (NP _ the[Article] body+`s[Saxon_Genitive] ) (AdjP other ) part+s[Plural] ) ] . (NP we ) (VP live ) (NP because_of the[Article] Son ) . (NP the[Article] Son ) (VP is ) (NP the[Article] (AdjP first ) person [ that[Relativizer] (NP God ) (VP caus+ed[Past_Tense] ) (NP ) [ (NP ) (VP to[INFL] become ) (AdjP alive ) (AdvP again ) ] ] ) . so (NP the[Article] Son ) (VP will[INFL] live ) (NP with God ) (AdvP forever ) . (NP God ) (VP will[INFL] cause ) (NP (AdjP many ) people ) [ (NP ) (VP to[INFL] become ) (AdjP alive ) (AdvP again ) ] . but (NP the[Article] Son ) (VP is ) (NP the[Article] (AdjP most[Degree] important ) person [ that[Relativizer] (NP God ) (VP will[INFL] cause ) (NP ) [ (NP ) (VP to[INFL] become ) (AdjP alive ) (AdvP again ) ] ] ) . Primary:[Proposition_Label] (NP God ) (VP caus+ed[Past_Tense] ) (NP the[Article] Son ) [ (NP ) (VP to[INFL] become ) (AdjP alive ) (AdvP again ) ] [ so_that (NP he ) (VP could[Mood] rule ) (NP (AdjP all ) thing+s[Plural] ) ] . Alternate_1:[Proposition_Label] _ (NP God ) (VP caus+ed[Past_Tense] ) (NP the[Article] Son ) [ (NP ) (VP to[INFL] become ) (AdjP alive ) (AdvP again ) ] [ so_that (NP he ) (VP could[Mood] be ) (AdjP more[Degree] important (NP than[Comparison_Marker] (AdjP all ) thing+s[Plural] ) ) ] . ,,,
19,Colossians 1:19,God is pleased because the Son has all the characteristics that he has. And the Son is the most important person because he has all the characteristics that God has.,,,
20,Colossians 1:20,"And God decided to cause all people and all things through the Son to become his friends. These people and things include people who are on the earth, things that are on there, people who are in heaven, and things that are in there. God decided to make peace with these people and these things through the blood that the Son gave to him when he was on the cross.~!~and (NP God ) (VP decid+ed[Past_Tense] ) [ (NP ) (VP to[INFL] cause ) (NP (AdjP all ) people ) (NP and (AdjP all ) thing+s[Plural] ) (NP through the[Article] Son ) [ (NP ) (NP ) (VP to[INFL] become ) (NP (NP _ his ) friend+s[Plural] ) ] ] . (NP these[Proximity] people ) (NP and thing+s[Plural] ) (VP include ) (NP people [ who[Relativizer] (NP ) (VP are ) (NP on the[Article] earth ) ] , ) (NP thing+s[Plural] [ that[Relativizer] (NP ) (VP are ) (NP on there ) ] , ) (NP people [ who[Relativizer] (NP ) (VP are ) (NP in heaven ) ] , ) (NP and thing+s[Plural] [ that[Relativizer] (NP ) (VP are ) (NP in there ) ] ) . (NP God ) (VP decid+ed[Past_Tense] ) [ (NP ) (VP to[INFL] make ) (NP peace ) (NP with these[Proximity] people ) (NP and these[Proximity] thing+s[Plural] ) (NP through the[Article] blood [ that[Relativizer] (NP the[Article] Son ) (VP gave ) (NP ) (NP to him ) [ when (NP he ) (VP was ) (NP on the[Article] cross ) , ] ] ) ] . ",,,
21,Colossians 1:21,Earlier you were not God's friends. You were God's enemies because you did bad things. And you did bad things because you thought about bad things.,,,
22,Colossians 1:22,But now God caused you through Christ's body to become his friends. And he'll cause you through Christ's death to be with him. Then you'll be holy and pure. And no person will accuse you of doing bad things.~!~but (AdvP now ) (NP God ) (VP caus+ed[Past_Tense] ) (NP you ) (NP through (NP _ Christ+`s[Saxon_Genitive] ) body ) [ (NP ) (VP to[INFL] become ) (NP (NP _ his ) friend+s[Plural] ) ] . and (NP he ) (VP will[INFL] cause ) (NP you ) (NP through (NP _ Christ+`s[Saxon_Genitive] ) death ) [ (NP ) (VP to[INFL] be ) (NP with him ) ] . then (NP you ) (VP will[INFL] be ) (AdjP holy ) (AdjP and pure ) . and (NP no[Noun_Polarity] person ) (VP will[INFL] accuse ) (NP you ) [ of[Complementizer] (NP ) (VP do+ing[Participle] ) (NP (AdjP bad ) thing+s[Plural] ) ] . ,,,
23,Colossians 1:23,"When you heard the good message, you heard about the wonderful things that God will do for you. But you must continue trusting in God. And you must continue hoping that the things that God describes to you in the good message will happen. God is telling his good message to all people, all angels, and all demons through his people and through his angels. And I work now to bring God's good message to people.",,,
24,Colossians 1:24,Title: Paul works to bring God's good message to people. Christ takes care of the group of Christians like the head takes care of the body. And he suffered for the group of Christians. And I suffer for you now happily to do the things that I still have to do.~!~Title:[Proposition_Label] (NP Paul ) (VP work+s[Third_Singular_Present] ) [ to (NP ) (VP bring ) (NP (NP _ God+`s[Saxon_Genitive] ) (AdjP good ) message ) (NP to people ) ] . (NP Christ ) (VP take+s[Third_Singular_Present] care[Verbal_Adjective_in_VP] ) (NP of (NP the[Pre-Nominal] group of ) Christian+s[Plural] ) [ like (NP the[Pre-Nominal] head ) (VP take+s[Third_Singular_Present] care[Verbal_Adjective_in_VP] ) (NP of the[Pre-Nominal] body ) ] . and (NP he ) (VP suffered ) (NP for (NP the[Pre-Nominal] group of ) Christian+s[Plural] ) . and (NP I ) (VP suffer ) (NP for you ) (AdvP now ) (AdvP happily ) [ to (NP ) (VP do ) (NP the[Pre-Nominal] thing+s[Plural] [ that[Relativizer] (NP I ) (VP (AdvP still ) have_to[Pre-Verbal] do ) (NP ) ] ) ] . ,,,
26,Colossians 1:26,Previously God didn't help people understand the things that he was doing. But he is showing these things to his holy people now.,,,
27,Colossians 1:27,"God wants his holy people to understand all the extremely wonderful things that he is doing. He planned to cause Christ to live in you, who aren't Jews. And you're able to expect God to do wonderful things for you in heaven because Christ lives in you.~!~(NP God ) (VP want+s[Third_Singular_Present] ) (NP (NP _ his ) (AdjP holy ) people ) [ (NP ) (VP to[Pre-Verbal] understand ) (NP (AdjP all ) the[Article] (AdjP extremely[Degree] wonderful ) thing+s[Plural] [ that[Relativizer] (NP he ) (VP is[Pre-Verbal] do+ing[Participle] ) (NP ) ] ) ] . (NP he ) (VP plann+ed[Past_Tense] ) [ (NP ) (VP to[Pre-Verbal] cause ) (NP Christ ) [ (NP ) (VP to[Pre-Verbal] live ) (NP in you [ , (NP who ) (NP ) (VP aren`t ) (NP Jew+s[Plural] ) , ] ) ] ] . and (NP you ) (VP are ) (AdjP able [ (NP ) (VP to[Pre-Verbal] expect ) (NP God ) [ (NP ) (VP to[Pre-Verbal] do ) (NP (AdjP wonderful ) thing+s[Plural] ) (NP for you ) (NP in heaven ) ] ] ) [ because (NP Christ ) (VP live+s[Third_Singular_Present] ) (NP in you ) ] . ",,,
28,Colossians 1:28,"We tell people about Christ. We warn all of these people to don't live badly. And we teach all of these people how to live well. Primary: We teach these people about God with his wisdom so that when they meet him, they would be perfect. Alternate 1: We teach these people about God with his wisdom so that when they meet him, they would have all the characteristics that they should have.~!~(NP we ) (VP tell ) (NP people ) (NP about Christ ) . (NP we ) (VP warn ) (NP (AdjP all of ) these[Proximity] people ) [ to[Complementizer] (NP ) (VP do not[Verb_Polarity] live (AdvP badly ) ) ] . and (NP we ) (VP teach ) (NP (AdjP all of ) these[Proximity] people ) [ how[Complementizer] (NP ) (VP to[INFL] live ) (AdvP well ) ] . Primary:[Proposition_Label] (NP we ) (VP teach ) (NP these[Proximity] people ) (NP about God ) (NP with (NP _ his ) wisdom ) [ so_that [ when (NP they ) (VP meet ) (NP him ) , ] (NP they ) (VP would[Mood] be ) (AdjP perfect ) ] . Alternate_1:[Proposition_Label] _ (NP we ) (VP teach ) (NP these[Proximity] people ) (NP about God ) (NP with (NP _ his ) wisdom ) [ so_that [ when (NP they ) (VP meet ) (NP him ) , ] (NP they ) (VP would[Mood] have ) (NP (AdjP all ) the[Article] characteristic+s[Plural] [ that[Relativizer] (NP they ) (VP should[Mood] have ) (NP ) ] ) ] . ",,,
29,Colossians 1:29,I work hard so that these people could be ready to meet God. I'm able to work hard for these people because God works hard through me.,,,
31,Colossians 2:1,"I want you to know that I'm struggling greatly for you, the Christians who are in Laodicea, and all the Christians who haven't met me.~!~(NP I ) (VP want ) (NP you ) [ (NP ) (VP to[Pre-Verbal] know ) [ that[Complementizer] (NP I ) (VP am[Pre-Verbal] struggl+ing[Participle] ) (AdvP greatly ) (NP for you , ) (NP the[Pre-Nominal] Christian+s[Plural] [ who[Relativizer] (NP ) (VP are ) (NP in Laodicea ) ] , ) (NP and (AdjP all ) the[Pre-Nominal] Christian+s[Plural] [ who[Relativizer] (NP ) (VP haven`t[Pre-Verbal] met ) (NP me ) ] ) ] ] . ",,,
33,Colossians 2:3,Before this time people didn't know about the things that God will do for you. These things are very valuable. You're able to know many things because Christ is in you. And you're able to be wise because Christ is in you.,,,
34,Colossians 2:4,I tell you about Christ so that other people couldn't say bad things that persuade you to have wrong thoughts.~!~(NP I ) (VP tell ) (NP you ) (NP about Christ ) [ so_that (NP (AdjP other ) people ) (VP couldn`t[Pre-Verbal] say ) (NP (AdjP bad ) thing+s[Plural] [ that[Relativizer] (NP ) (VP persuade ) (NP you ) [ (NP ) (VP to[Pre-Verbal] have ) (NP (AdjP wrong ) thought+s[Plural] ) ] ] ) ] . ,,,
36,Colossians 2:6,"Title: Do good things like God's people should do good things. Title: And don't believe the wrong things that some people teach you about. Do good things like after you started believing in Jesus Christ, you did good things.~!~Title:[Proposition_Label] (NP ) (VP do ) (NP (AdjP good ) thing+s[Plural] ) [ like (NP (NP _ God+`s[Saxon_Genitive] ) people ) (VP should[Mood] do ) (NP (AdjP good ) thing+s[Plural] ) ] . Title:[Proposition_Label] and (NP ) (VP do not[Verb_Polarity] believe ) (NP the[Article] (AdjP wrong ) thing+s[Plural] [ that[Relativizer] (NP some[Article] people ) (VP teach ) (NP you ) (NP about ) ] ) . (NP ) (VP do ) (NP (AdjP good ) thing+s[Plural] ) [ like [ after (NP you ) (VP start+ed[Past_Tense] believ+ing[Participle] ) (NP in Jesus (NP _ Christ ) ) , ] (NP you ) (VP did ) (NP (AdjP good ) thing+s[Plural] ) ] . ",,,
37,Colossians 2:7,You'll truly be alive because you continue trusting in Jesus like a plant that is planted in the ground by a person is healthy. And God will cause you to have a good relationship with him because you continue trusting in Jesus like a person builds a building that is beautiful. Continue believing the things that we taught you about. And always thank God greatly.~!~(NP you ) (VP will[INFL] (AdvP truly ) be ) (AdjP alive ) [ because (NP you ) (VP continue trust+ing[Participle] ) (NP in Jesus ) ] [ like (NP a[Article] plant [ that[Relativizer] (NP ) (VP is plant+ed[Past_Tense] ) (NP in the[Article] ground ) (NP by a[Article] person ) ] ) (VP is ) (AdjP healthy ) ] . and (NP God ) (VP will[INFL] cause ) (NP you ) [ (NP ) (VP to[INFL] have ) (NP a[Article] (AdjP good ) relationship (NP with him ) ) ] [ because (NP you ) (VP continue trust+ing[Participle] ) (NP in Jesus ) ] [ like (NP a[Article] person ) (VP build+s[Third_Singular_Present] ) (NP a[Article] building [ that[Relativizer] (NP ) (VP is ) (AdjP beautiful ) ] ) ] . (NP ) (VP continue believ+ing[Participle] ) (NP the[Article] thing+s[Plural] [ that[Relativizer] (NP we ) (VP taught ) (NP you ) (NP about ) ] ) . and (NP ) (VP (AdvP always ) thank ) (NP God ) (AdvP greatly ) . ,,,
38,Colossians 2:8,Some people think that certain other people are wise. Those other people teach people about wrong ideas. Primary: Those ideas are about the things that people should do. Alternate 1: But demons made the ideas that other people taught people about. End of Alternates. Christ doesn't teach people about those ideas. And those ideas aren't valuable. Don't allow those people to deceive you. And don't allow those people to cause you to stop trusting in Christ.~!~(NP some[Article] people ) (VP think ) [ that[Complementizer] (NP (AdjP certain ) (AdjP other ) people ) (VP are ) (AdjP wise ) ] . (NP those[Proximity] (AdjP other ) people ) (VP teach ) (NP people ) (NP about (AdjP wrong ) idea+s[Plural] ) . Primary:[Proposition_Label] (NP those[Proximity] idea+s[Plural] ) (VP are ) (NP about the[Article] thing+s[Plural] [ that[Relativizer] (NP people ) (VP should[Pre-Verbal] do ) (NP ) ] ) . Alternate_1:[Proposition_Label] but _ (NP demon+s[Plural] ) (VP made ) (NP the[Article] idea+s[Plural] [ that[Relativizer] (NP (AdjP other ) people ) (VP taught ) (NP people ) (NP about ) ] ) . End_of_Alternates.[End_of_Alternates] (NP Christ ) (VP doesn`t[Pre-Verbal] teach ) (NP people ) (NP about those[Proximity] idea+s[Plural] ) . and (NP those[Proximity] idea+s[Plural] ) (VP aren`t ) (AdjP valuable ) . (NP ) (VP don`t[Pre-Verbal] allow ) (NP those[Proximity] people ) [ (NP ) (VP to[Pre-Verbal] deceive ) (NP you ) ] . and (NP ) (VP don`t[Pre-Verbal] allow ) (NP those[Proximity] people ) [ (NP ) (VP to[Pre-Verbal] cause ) (NP you ) [ (NP ) (VP to_stop[Pre-Verbal] trust+ing[Participle] ) (NP in Christ ) ] ] . ,,,
39,Colossians 2:9,"When Christ was a person, he completely was God.",,,
40,Colossians 2:10,"You have all the things that you need because you're united by God with Christ. Christ rules all people, all angels, and all demons.",,,
41,Colossians 2:11,"When a man becomes a Jew, a priest circumcises him. And when a Jewish boy is one week old, a priest circumcises him. Similarly when a person is united by God with Christ, the power of the bad things that are in him is taken away from him by God. God doesn't do this by cutting the person's body. But he does this through Christ.~!~[ when (NP a[Pre-Nominal] man ) (VP become+s[Third_Singular_Present] ) (NP a[Pre-Nominal] Jew ) , ] (NP a[Pre-Nominal] priest ) (VP circumcise+s[Third_Singular_Present] ) (NP him ) . and [ when (NP a[Pre-Nominal] (AdjP Jewish ) boy ) (VP is ) (AdjP (NP (AdjP one ) week ) old ) , ] (NP a[Pre-Nominal] priest ) (VP circumcise+s[Third_Singular_Present] ) (NP him ) . similarly [ when (NP a[Pre-Nominal] person ) (VP is[Pre-Verbal] unit+ed[Past_Tense] ) (NP by God ) (NP with Christ ) , ] (NP the[Pre-Nominal] power (NP of the[Pre-Nominal] (AdjP bad ) thing+s[Plural] [ that[Relativizer] (NP ) (VP are ) (NP in him ) ] ) ) (VP is[Pre-Verbal] taken away[Verbal_Adposition_moved_to_Direct_Object] ) (NP from him ) (NP by God ) . (NP God ) (VP doesn`t[Pre-Verbal] do ) (NP this[Pre-Nominal] ) [ by (NP ) (VP cutt+ing[Participle] ) (NP (NP _ the[Pre-Nominal] person+`s[Saxon_Genitive] ) body ) ] . but (NP he ) (VP does ) (NP this[Pre-Nominal] ) (NP through Christ ) . ",,,
42,Colossians 2:12,"And when you become Christians, a disciple puts your bodies under water. You don't continue having your old lives because people buried Christ's body. And God gave a new life to you because Christ became alive again. God gave this new life to you because of your faith.",,,
43,Colossians 2:13,"Because of the bad things that you did, you had a bad relationship with God. And because of the bad things that were in you, you had a bad relationship with God. But God caused you to have a good relationship with him by forgiving all the bad things that you did.",,,
44,Colossians 2:14,"But God destroyed the book that contained all the bad things that you did. When Jesus died on the cross, God destroyed that book.~!~but (NP God ) (VP destroy+ed[Past_Tense] ) (NP the[Pre-Nominal] book [ that[Relativizer] (NP ) (VP contain+ed[Past_Tense] ) (NP (AdjP all ) the[Pre-Nominal] (AdjP bad ) thing+s[Plural] [ that[Relativizer] (NP you ) (VP did ) (NP ) ] ) ] ) . [ when (NP Jesus ) (VP di+ed[Past_Tense] ) (NP on the[Pre-Nominal] cross ) , ] (NP God ) (VP destroy+ed[Past_Tense] ) (NP that[Pre-Nominal] book ) . ",,,
45,Colossians 2:15,"When Christ died on the cross, God took power away from the demons. And he showed people that he defeated those demons.",,,
47,Colossians 2:17,These things that people do are like shadows. But Christ is like the person who makes these shadows.,,,
48,Colossians 2:18,"Some people tell you that you should pretend to be very humble. And they tell you that you should worship angels. They talk about the things that they think that they saw. And because of the ideas that these people have, they are very proud. Don't allow these people to judge you.~!~(NP some[Article] people ) (VP tell ) (NP you ) [ that[Complementizer] (NP you ) (VP should[Mood] pretend ) [ (NP ) (VP to[INFL] be ) (AdjP very[Degree] humble ) ] ] . and (NP they ) (VP tell ) (NP you ) [ that[Complementizer] (NP you ) (VP should[Mood] worship ) (NP angel+s[Plural] ) ] . (NP they ) (VP talk ) (NP about the[Article] thing+s[Plural] [ that[Relativizer] (NP they ) (VP think ) [ that[Complementizer] (NP they ) (VP saw ) (NP ) ] ] ) . and (NP because_of the[Article] idea+s[Plural] [ that[Relativizer] (NP these[Proximity] people ) (VP have ) (NP ) ] , ) (NP they ) (VP are ) (AdjP very[Degree] proud ) . (NP ) (VP do not[Verb_Polarity] allow ) (NP these[Proximity] people ) [ (NP ) (VP to[INFL] judge ) (NP you ) ] . ",,,
