ID,Reference,Verse,Notes,NoteFonts,Residue
339,1 Kings 9:5,"If you do these things, I'll cause your family to rule Israel forever. I promised David, who was your father, that I would do this thing. I said to David, “A person who was in your family will always be the king of Israel.”If you do these things, I'll cause your family to rule Israel forever. I promised David, who was your father, that I would do this. I said to David, “A person who is in your family will always be the king of Israel.”~!~[ if (NP you ) (VP do ) (NP these[Pre-Nominal] thing+s[Plural] ) , ] (NP I ) (VP will[Pre-Verbal] cause ) (NP (NP _ your ) family ) [ (NP ) (VP to[Pre-Verbal] rule ) (NP Israel ) (AdvP forever ) ] . (NP I ) (VP promis+ed[Past_Tense] ) (NP David [ , (NP who ) (NP (NP ) ) (VP was ) (NP (NP _ your ) father ) , ] ) [ that[Complementizer] (NP I ) (VP would[Pre-Verbal] do ) (NP this[Pre-Nominal] ) ] . (NP I ) (VP said ) (NP to David ) [ ,_“ (NP a[Pre-Nominal] person [ who[Relativizer] (NP ) (VP is ) (NP in (NP _ your ) family ) ] ) (VP will[Pre-Verbal] (AdvP always ) be ) (NP the[Pre-Nominal] king (NP of Israel ) ) ” ] . ",,,
340,1 Kings 9:6,But you and your family must not refuse to follow me. You must not refuse to obey the laws and commands that I gave to you. You must not serve other gods. And you must not worship other gods.But you and your family must not refuse to follow me. You must not refuse to obey the laws and commands that I gave to you. You must not serve other gods. And you must not worship other gods.~!~but (NP you ) (NP and (NP _ your ) family ) (VP must_not[Pre-Verbal] refuse ) [ (NP ) (NP ) (VP to[Pre-Verbal] follow ) (NP me ) ] . (NP you ) (VP must_not[Pre-Verbal] refuse ) [ (NP ) (VP to[Pre-Verbal] obey ) (NP the[Pre-Nominal] law+s[Plural] ) (NP and command+s[Plural] [ that[Relativizer] (NP I ) (VP gave ) (NP ) (NP to you ) ] ) ] . (NP you ) (VP must_not[Pre-Verbal] serve ) (NP (AdjP other ) god+s[Plural] ) . and (NP you ) (VP must_not[Pre-Verbal] worship ) (NP (AdjP other ) god+s[Plural] ) . ,,,
341,1 Kings 9:7,"If you do these things, I'll force the people of Israel to leave the special land that I gave to them. Although I caused you to build this temple for me, I'll leave it. I'll stop protecting this temple. I'll stop loving this temple. Then Israel will become a joke. And all of the nations will laugh at Israel.If you do these things, I'll force the Israelites to leave the special land that I gave to them. Although I caused you to build this temple for me, I'll leave it. I'll stop protecting this temple. I'll stop loving this temple. Then Israel will become a joke. And all of the nations will laugh at Israel.~!~[ if (NP you ) (VP do ) (NP these[Pre-Nominal] thing+s[Plural] ) , ] (NP I ) (VP will[Pre-Verbal] force ) (NP the[Pre-Nominal] Israelite+s[Plural] ) [ (NP ) (VP to[Pre-Verbal] leave ) (NP the[Pre-Nominal] (AdjP special ) land [ that[Relativizer] (NP I ) (VP gave ) (NP ) (NP to them ) ] ) ] . [ although (NP I ) (VP caus+ed[Past_Tense] ) (NP you ) [ (NP ) (VP to[Pre-Verbal] build ) (NP this[Pre-Nominal] temple ) (NP for me ) ] , ] (NP I ) (VP will[Pre-Verbal] leave ) (NP it ) . (NP I ) (VP will_stop[Pre-Verbal] protect+ing[Participle] ) (NP this[Pre-Nominal] temple ) . (NP I ) (VP will_stop[Pre-Verbal] lov+ing[Participle] ) (NP this[Pre-Nominal] temple ) . then (NP Israel ) (VP will[Pre-Verbal] become ) (NP a[Pre-Nominal] joke ) . and (NP (AdjP all of ) the[Pre-Nominal] nation+s[Plural] ) (VP will[Pre-Verbal] laugh ) (NP at Israel ) . ",,,
342,1 Kings 9:8,"Then this temple will become a pile of stones. All people who pass this temple will be amazed. And they'll laugh at this temple. They'll say, “Why did Yahweh do this thing to this land and this temple?”Then this temple will become a pile of stones. All people who pass this temple will be amazed. And they'll laugh at this temple. They'll say, “Why did the LORD do this to this land and this temple?”~!~then (NP this[Pre-Nominal] temple ) (VP will[Pre-Verbal] become ) (NP a[Pre-Nominal] pile (NP of stone+s[Plural] ) ) . (NP (AdjP all ) people [ who[Relativizer] (NP ) (VP pass ) (NP this[Pre-Nominal] temple ) ] ) (VP will[Pre-Verbal] be ) (AdjP amazed ) . and (NP they ) (VP will[Pre-Verbal] laugh ) (NP at this[Pre-Nominal] temple ) . (NP they ) (VP will[Pre-Verbal] say ) [ ,_“ (NP (AdvP why ) ) (VP did[CP-VP] ) (NP the[Pre-Nominal] LORD ) (VP do ) (NP this[Pre-Nominal] ) (NP to this[Pre-Nominal] land ) (NP and this[Pre-Nominal] temple ) ? ” ] . ",,,
343,1 Kings 9:9,"Other people will answer, “Yahweh did this thing because Israel's people left him, who was their God, and who brought their ancestors from Egypt. But those people chose other gods. They worshiped those gods and served them. Yahweh brought all of this terrible trouble to those people because of these things.”Other people will answer, “The LORD did this because Israel's people left him, who was their God, and who brought their ancestors from Egypt. But those people chose other gods. They worshiped those gods and served them. The LORD brought all of this terrible trouble to those people because of these things.”~!~(NP (AdjP other ) people ) (VP will[Pre-Verbal] answer ) [ ,_“ (NP the[Pre-Nominal] LORD ) (VP did ) (NP this[Pre-Nominal] ) [ because (NP (NP _ Israel+`s[Saxon_Genitive] ) people ) (VP left ) (NP him [ , (NP who ) (NP (NP ) ) (VP was ) (NP (NP _ their ) God ) , ] [ , and (NP who ) (NP (NP ) ) (VP brought ) (NP (NP _ their ) ancestor+s[Plural] ) (NP from Egypt ) , ] ) ] ] . but (NP those[Pre-Nominal] people ) (VP chose ) (NP (AdjP other ) god+s[Plural] ) . (NP they ) (VP worshiped ) (NP those[Pre-Nominal] god+s[Plural] ) [ and (NP ) (VP serv+ed[Past_Tense] ) (NP them ) ] . (NP the[Pre-Nominal] LORD ) (VP brought ) (NP (AdjP all of ) this[Pre-Nominal] (AdjP terrible ) trouble ) (NP to those[Pre-Nominal] people ) (NP because_of these[Pre-Nominal] thing+s[Plural] ) . ” ",,,
344,1 Kings 9:10,After twenty years Solomon finished building the temple of Yahweh and his house.After twenty years Solomon finished building the LORD's temple and his palace.~!~(NP after (AdjP twenty ) year+s[Plural] ) (NP Solomon ) (VP finished[Pre-Verbal] build+ing[Participle] ) (NP (NP _ the[Pre-Nominal] LORD+`s[Saxon_Genitive] ) temple ) (NP and (NP _ his ) palace ) . ,,,
345,1 Kings 9:11,"Then King Solomon gave twenty towns in Galilee to Hiram, who was the king of Tyre, because previously Hiram gave him all of the Cedar tree wood that he wanted, all of the Cypress tree wood that he wanted, and all of the gold that he wanted.Then King Solomon gave twenty towns in Galilee to Hiram, who was the king of Tyre, because previously Hiram gave him all of the Cedar tree wood that he wanted, all of the Cypress tree wood that he wanted, and all of the gold that he wanted.~!~then (NP (NP _ King ) Solomon ) (VP gave ) (NP (AdjP twenty ) town+s[Plural] (NP in Galilee ) ) (NP to Hiram [ , (NP who ) (NP (NP ) ) (VP was ) (NP the[Pre-Nominal] king (NP of Tyre ) ) , ] ) [ because (AdvP previously ) (NP Hiram ) (VP gave ) (NP him ) (NP (AdjP all of ) the[Pre-Nominal] (NP _ Cedar[First_Word_of_Compound_Noun] tree ) wood [ that[Relativizer] (NP he ) (VP want+ed[Past_Tense] ) (NP ) ] , ) (NP (AdjP all of ) the[Pre-Nominal] (NP _ Cypress[First_Word_of_Compound_Noun] tree ) wood [ that[Relativizer] (NP he ) (VP want+ed[Past_Tense] ) (NP ) ] , ) (NP and (AdjP all of ) the[Pre-Nominal] gold [ that[Relativizer] (NP he ) (VP want+ed[Past_Tense] ) (NP ) ] ) ] . ",,,
346,1 Kings 9:12,"Hiram came from Tyre in order to see the towns that Solomon had given to him. But when Hiram saw those towns, they didn't please him.Hiram came from Tyre to see the towns that Solomon had given to him. But when Hiram saw those towns, they didn't please him.~!~(NP Hiram ) (VP came ) (NP from Tyre ) [ to (NP ) (VP see ) (NP the[Pre-Nominal] town+s[Plural] [ that[Relativizer] (NP Solomon ) (VP had[Pre-Verbal] given ) (NP ) (NP to him ) ] ) ] . but [ when (NP Hiram ) (VP saw ) (NP those[Pre-Nominal] town+s[Plural] ) , ] (NP they ) (VP didn`t[Pre-Verbal] please ) (NP him ) . ",,,
347,1 Kings 9:13,"Hiram said, “My friend, these towns that you have given to me aren't very good towns.” And Hiram called those towns ‘the land of Kabul’. Today people still call those towns ‘the land of Kabul’.Hiram said, “Hiram's friend, these towns that you have given to me aren't very good towns.” And he called those towns 'the land of Kabul'. Today people still call those towns 'the land of Kabul'.~!~(NP Hiram ) (VP said ) [ ,_“ (NP (NP _ Hiram+`s[Saxon_Genitive] ) friend , ) (NP these[Pre-Nominal] town+s[Plural] [ that[Relativizer] (NP you ) (VP have[Pre-Verbal] given ) (NP ) (NP to me ) ] ) (VP aren`t ) (NP (AdjP very[Pre-Adjective] good ) town+s[Plural] ) ” ] . and (NP he ) (VP call+ed[Past_Tense] ) (NP those[Pre-Nominal] town+s[Plural] ) (NP ` the[Pre-Nominal] land (NP of Kabul ) ~ ) . (AdvP today ) (NP people ) (VP (AdvP still ) call ) (NP those[Pre-Nominal] town+s[Plural] ) (NP ` the[Pre-Nominal] land (NP of Kabul ) ~ ) . ",,,
348,1 Kings 9:14,Previously Hiram sent 4100 kilograms of gold to Solomon.Previously Hiram sent of gold to Solomon.~!~(AdvP previously ) (NP Hiram ) (VP sent ) (NP (NP (AdjP ) of ) gold ) (NP to Solomon ) . ,,,
349,1 Kings 9:15,"King Solomon forced people to work hard for him. Those people built the temple of Yahweh, Solomon's house, Millo, Jerusalem's wall, Hazor, Megiddo, and Gezer.King Solomon forced people to work hard for him. Those people built the LORD's temple, Solomon's palace, the Millo, the wall of Jerusalem, <<the town named>> Hazor, <<the town named>> Megiddo, and <<the town named>> Gezer.~!~(NP (NP _ King ) Solomon ) (VP forc+ed[Past_Tense] ) (NP people ) [ (NP ) (VP to[Pre-Verbal] work (AdvP hard ) ) (NP for him ) ] . (NP those[Pre-Nominal] people ) (VP built ) (NP (NP _ the[Pre-Nominal] LORD+`s[Saxon_Genitive] ) temple , ) (NP (NP _ Solomon+`s[Saxon_Genitive] ) palace , ) (NP the[Pre-Nominal] Millo , ) (NP the[Pre-Nominal] wall (NP of Jerusalem ) , ) (NP (NP <<[Opening_Implicit_Marker] the[Pre-Nominal] town named >>[Closing_Implicit_Marker] ) Hazor , ) (NP (NP <<[Opening_Implicit_Marker] the[Pre-Nominal] town named >>[Closing_Implicit_Marker] ) Megiddo , ) (NP and (NP <<[Opening_Implicit_Marker] the[Pre-Nominal] town named >>[Closing_Implicit_Marker] ) Gezer ) . ",,,
350,1 Kings 9:16,Previously the king of Egypt attacked Gezer and defeated it. He burned Gezer and killed the Canaanites who lived there. Then he gave Gezer to his daughter because she was marrying Solomon.Previously the king of Egypt attacked Gezer and defeated it. He burned Gezer and killed the Canaanites who lived there. Then he gave Gezer to the princess because she was marrying Solomon.~!~(AdvP previously ) (NP the[Pre-Nominal] king (NP of Egypt ) ) (VP attack+ed[Past_Tense] ) (NP Gezer ) [ and (NP ) (VP defeat+ed[Past_Tense] ) (NP it ) ] . (NP he ) (VP burn+ed[Past_Tense] ) (NP Gezer ) [ and (NP ) (VP kill+ed[Past_Tense] ) (NP the[Pre-Nominal] Canaanite+s[Plural] [ who[Relativizer] (NP ) (VP liv+ed[Past_Tense] ) (NP there ) ] ) ] . then (NP he ) (VP gave ) (NP Gezer ) (NP to the[Pre-Nominal] princess ) [ because (NP she ) (VP was[Pre-Verbal] marry+ing[Participle] ) (NP Solomon ) ] . ,,,
351,1 Kings 9:17,So Solomon forced those people to build Gezer again. Those people also built Beth-Horon that was in a valley.So Solomon forced those people to build Gezer again. Those people also built <<the town named>> Beth Horon that was in a valley.~!~so (NP Solomon ) (VP forc+ed[Past_Tense] ) (NP those[Pre-Nominal] people ) [ (NP ) (VP to[Pre-Verbal] build ) (NP Gezer ) (AdvP again ) ] . (NP those[Pre-Nominal] people ) (VP (AdvP also ) built ) (NP (NP <<[Opening_Implicit_Marker] the[Pre-Nominal] town named >>[Closing_Implicit_Marker] ) Beth_Horon [ that[Relativizer] (NP ) (VP was ) (NP in a[Pre-Nominal] valley ) ] ) . ,,,
352,1 Kings 9:18,"Those people also built Baalath and Tamar, which was in the desert of Judah.Those people also built Baalath and the tamarisk tree, which was in the desert of Judah.~!~(NP those[Pre-Nominal] people ) (VP (AdvP also ) built ) (NP Baalath ) (NP and the[Pre-Nominal] tamarisk[First_Word_of_Compound_Noun] tree [ , (NP which ) (NP (NP ) ) (VP was ) (NP in the[Pre-Nominal] desert (NP of Judah ) ) , ] ) . ",,,
353,1 Kings 9:19,"Those people also built cities where Solomon stored things. And they built cities for chariots. They also built cities for horses and the people who rode them. And they also built in Jerusalem, in Lebanon, and in all of the land where Solomon ruled people all of the other things that he wanted to build.Those people also built cities where Solomon stored things. And they built cities for chariots. They also built cities for horses and the people who rode them. And they also built in Jerusalem, in Lebanon, and in all of the land where Solomon ruled people all of the other things that he wanted to build.~!~(NP those[Pre-Nominal] people ) (VP (AdvP also ) built ) (NP citi+es[Plural] [ where[Relativizer] (NP Solomon ) (VP stor+ed[Past_Tense] ) (NP thing+s[Plural] ) (NP ) ] ) . and (NP they ) (VP built ) (NP citi+es[Plural] ) (NP for chariot+s[Plural] ) . (NP they ) (VP (AdvP also ) built ) (NP citi+es[Plural] ) (NP for horse+s[Plural] ) (NP and the[Pre-Nominal] people [ who[Relativizer] (NP ) (VP rode ) (NP them ) ] ) . and (NP they ) (VP (AdvP also ) built ) (NP in Jerusalem , ) (NP in Lebanon , ) (NP and in (AdjP all of ) the[Pre-Nominal] land [ where[Relativizer] (NP Solomon ) (VP rul+ed[Past_Tense] ) (NP people ) (NP ) ] ) (NP (AdjP all of ) the[Pre-Nominal] (AdjP other ) thing+s[Plural] [ that[Relativizer] (NP he ) (VP want+ed[Past_Tense] ) [ (NP ) (VP to[Pre-Verbal] build ) (NP ) ] ] ) . ",,,
354,1 Kings 9:20,"At that time there still were some people who were not Israelites in the land of Israel. They were Amorites, Hivites, Perizzites, Hittites, and Jebusites.At that time there still were some people who weren't Israelites in the land of Israel. They were Amorites, Hivites, Perizzites, Hittites, and Jebusites.~!~at_that_time (NP there[Existential_Expletive] ) (VP (VP (AdvP still ) were ) ) (NP some[Pre-Nominal] people [ who[Relativizer] (NP ) (VP were not[Post-Verbal] ) (NP Israelite+s[Plural] ) ] ) (NP in the[Pre-Nominal] land (NP of Israel ) ) . (NP they ) (VP were ) (NP Amorite+s[Plural] , ) (NP Hivite+s[Plural] , ) (NP Perizzite+s[Plural] , ) (NP Hittite+s[Plural] , ) (NP and Jebusite+s[Plural] ) . ",,,
355,1 Kings 9:21,Those people were the descendants of the people that the Israelites were not able to kill during the time when Joshua was alive. Solomon forced those people to be his slaves. Today those people still are slaves.Those people were the descendants of the people that the Israelites weren't able to kill during the time when Joshua was alive. Solomon forced those people to be his slaves. Today those people still are slaves.~!~(NP those[Pre-Nominal] people ) (VP were ) (NP the[Pre-Nominal] descendant+s[Plural] (NP of _ the[Pre-Nominal] people [ that[Relativizer] (NP the[Pre-Nominal] Israelite+s[Plural] ) (VP were not[Post-Verbal] ) (AdjP able [ (NP ) (VP to[Pre-Verbal] kill ) (NP ) ] ) (NP during the[Pre-Nominal] time [ when[Relativizer] (NP Joshua ) (VP was ) (AdjP alive ) (NP ) ] ) ] ) ) . (NP Solomon ) (VP forc+ed[Past_Tense] ) (NP those[Pre-Nominal] people ) [ (NP ) (VP to[Pre-Verbal] be ) (NP (NP _ his ) slave+s[Plural] ) ] . (AdvP today ) (NP those[Pre-Nominal] people ) (VP (AdvP still ) are ) (NP slave+s[Plural] ) . ,,,
356,1 Kings 9:22,"But Solomon didn't force any Israelites to become his slaves. Instead some Israelites became Solomon's soldiers, his officials, his people who led his army, his captains, his soldiers who rode chariots, and his soldiers who rode horses.But Solomon didn't force any Israelites to become his slaves. Instead, some Israelites became Solomon's soldiers, his officials, his people who led his army, his captains, his soldiers who rode chariots, and his soldiers who rode horses.~!~but (NP Solomon ) (VP didn`t[Pre-Verbal] force ) (NP (AdjP any ) Israelite+s[Plural] ) [ (NP ) (VP to[Pre-Verbal] become ) (NP (NP _ his ) slave+s[Plural] ) ] . instead, (NP some[Pre-Nominal] Israelite+s[Plural] ) (VP became ) (NP (NP _ Solomon+`s[Saxon_Genitive] ) soldier+s[Plural] , ) (NP (NP _ his ) official+s[Plural] , ) (NP (NP _ his ) people [ who[Relativizer] (NP ) (VP led ) (NP (NP _ his ) army ) ] , ) (NP (NP _ his ) captain+s[Plural] , ) (NP (NP _ his ) soldier+s[Plural] [ who[Relativizer] (NP ) (VP rode ) (NP chariot+s[Plural] ) ] , ) (NP and (NP _ his ) soldier+s[Plural] [ who[Relativizer] (NP ) (VP rode ) (NP horse+s[Plural] ) ] ) . ",,,
357,1 Kings 9:23,Other Israelites were the chief officials who led the people who built Solomon's buildings and his cities. The number of those officials was 550.Other Israelites were the chief officials who led the people who built Solomon's buildings and his cities. The number of those officials was 550.~!~(NP (AdjP other ) Israelite+s[Plural] ) (VP were ) (NP the[Pre-Nominal] (AdjP chief ) official+s[Plural] [ who[Relativizer] (NP ) (VP led ) (NP the[Pre-Nominal] people [ who[Relativizer] (NP ) (VP built ) (NP (NP _ Solomon+`s[Saxon_Genitive] ) building+s[Plural] ) (NP and (NP _ his ) citi+es[Plural] ) ] ) ] ) . (NP the[Pre-Nominal] number (NP of those[Pre-Nominal] official+s[Plural] ) ) (VP was ) (AdjP 550 ) . ,,,
358,1 Kings 9:24,The daughter of the king of Egypt moved from Jerusalem to the house that Solomon built for her. Then Solomon built Millo.The daughter of the king of Egypt moved from Jerusalem to the house that Solomon built for her. Then Solomon built the Millo.~!~(NP the[Article] daughter (NP of _ the[Pre-Nominal] king (NP of Egypt ) ) ) (VP mov+ed[Past_Tense] ) (NP from Jerusalem ) (NP to the[Pre-Nominal] house [ that[Relativizer] (NP Solomon ) (VP built ) (NP ) (NP for her ) ] ) . then (NP Solomon ) (VP built ) (NP the[Pre-Nominal] Millo ) . ,,,
359,1 Kings 9:25,Solomon gave God animals that people completely burned. And Solomon gave animals to God in order to have peace with him. Three times each year Solomon gave these animals to God on the the bronze structure that Solomon made for Yahweh. Solomon also burned for Yahweh substance that smelled good. And so Solomon finished building the temple of Yahweh.Solomon gave God animals that people completely burned. And Solomon gave animals to God to have peace with him. Three times each year Solomon gave these animals to God on the the bronze altar that Solomon made for the LORD. Solomon also burned for the LORD incense that smelled good. And so Solomon finished building the LORD's temple.~!~(NP Solomon ) (VP gave ) (NP God ) (NP animal+s[Plural] [ that[Relativizer] (NP people ) (VP (AdvP completely ) burn+ed[Past_Tense] ) (NP ) ] ) . and (NP Solomon ) (VP gave ) (NP animal+s[Plural] ) (NP to God ) [ to (NP ) (VP have ) (NP peace ) (NP with him ) ] . (NP _ (AdjP three ) time+s[Plural] ) (NP (AdjP each ) year (NP Solomon ) ) (VP gave ) (NP these[Pre-Nominal] animal+s[Plural] ) (NP to God ) (NP on the[Pre-Nominal] (NP _ the[Pre-Nominal] bronze ) altar [ that[Relativizer] (NP Solomon ) (VP made ) (NP ) (NP for the[Pre-Nominal] LORD ) ] ) . (NP Solomon ) (VP (AdvP also ) burn+ed[Past_Tense] ) (NP for the[Pre-Nominal] LORD ) (NP incense [ that[Relativizer] (NP ) (VP smell+ed[Past_Tense] ) (AdjP good ) ] ) . and_so (NP Solomon ) (VP finished[Pre-Verbal] build+ing[Participle] ) (NP (NP _ the[Pre-Nominal] LORD+`s[Saxon_Genitive] ) temple ) . ,,,
360,1 Kings 9:26,"King Solomon also built ships at Ezion-geber, which was near Elath, in Edom, and on the Red Sea's shore.King Solomon also built ships at <<the town named>> Ezion Geber, which was near Elath, in Edom, and on the shore of the Red Sea.~!~(NP (NP _ King ) Solomon ) (VP (AdvP also ) built ) (NP ship+s[Plural] ) (NP at (NP <<[Opening_Implicit_Marker] the[Pre-Nominal] town named >>[Closing_Implicit_Marker] ) Ezion_Geber [ , (NP which ) (NP (NP ) ) (VP was ) (NP near Elath , ) (NP in Edom , ) (NP and on the[Pre-Nominal] shore (NP of the[Pre-Nominal] Red[First_Word_of_Compound_Noun] Sea ) ) , ] ) . ",,,
361,1 Kings 9:27,Hiram sent on the ships with Solomon's servants his servants who knew many things about the sea.Hiram sent on the ships with Solomon's servants his servants who knew many things about the sea.~!~(NP Hiram ) (VP sent ) (NP on the[Pre-Nominal] ship+s[Plural] ) (NP with (NP _ Solomon+`s[Saxon_Genitive] ) servant+s[Plural] ) (NP (NP _ his ) servant+s[Plural] [ who[Relativizer] (NP ) (VP knew ) (NP (AdjP many ) thing+s[Plural] (NP about the[Pre-Nominal] sea ) ) ] ) . ,,,
362,1 Kings 9:28,Those people rode in the ships to Ophir and returned with 14500 kilograms of gold. They gave the gold to King Solomon.Those people rode in the ships to Ophir and returned with 14 of gold. They gave the gold to King Solomon.~!~(NP those[Pre-Nominal] people ) (VP rode ) (NP in the[Pre-Nominal] ship+s[Plural] ) (NP to Ophir ) [ and (NP ) (VP return+ed[Past_Tense] ) (NP with (NP (AdjP 14 ) of ) gold ) ] . (NP they ) (VP gave ) (NP the[Pre-Nominal] gold ) (NP to (NP _ King ) Solomon ) . ,,,
363,1 Kings 10:1,Primary: The queen of Sheba heard that Solomon was very famous because of Yahweh's name. Alternate 1: The queen of Sheba heard that Solomon was very famous because of Yahweh. End of Alternates. She also heard that Solomon served Yahweh. So she came in order to test Solomon. She came to Solomon in order to ask Solomon difficult questions.Primary: The queen of Sheba heard that Solomon was very famous because of the LORD's name. Alternate 1: The queen of Sheba heard that Solomon was very famous because of the LORD. End of Alternates. She also heard that Solomon served the LORD. So she came to test Solomon. She came to Solomon to ask Solomon difficult questions.~!~Primary:[Proposition_Label] (NP the[Pre-Nominal] queen (NP of Sheba ) ) (VP heard ) [ that[Complementizer] (NP Solomon ) (VP was ) (AdjP very[Pre-Adjective] famous (NP because_of (NP _ the[Pre-Nominal] LORD+`s[Saxon_Genitive] ) name ) ) ] . Alternate_1:[Proposition_Label] (NP the[Pre-Nominal] queen (NP of Sheba ) ) (VP heard ) [ that[Complementizer] (NP Solomon ) (VP was ) (AdjP very[Pre-Adjective] famous (NP because_of the[Pre-Nominal] LORD ) ) ] . End_of_Alternates.[End_of_Alternates] (NP she ) (VP (AdvP also ) heard ) [ that[Complementizer] (NP Solomon ) (VP serv+ed[Past_Tense] ) (NP the[Pre-Nominal] LORD ) ] . so (NP she ) (VP came ) [ to (NP ) (VP test ) (NP Solomon ) ] . (NP she ) (VP came ) (NP to Solomon ) [ to (NP ) (VP ask ) (NP Solomon ) (NP (AdjP difficult ) question+s[Plural] ) ] . ,,,
364,1 Kings 10:2,"The queen of Sheba arrived in Jerusalem and brought a very big group of servants. The queen's camels were carrying spices, very big amounts of gold, and valuable stones. The queen came to Solomon and asked him about all of the things that she wanted to know.The queen of Sheba arrived in in Jerusalem and brought a very big group of servants. The queen's camels were carrying seeds that people put in food so that it would taste good, very big amounts of gold, and valuable gems. The queen came to Solomon and asked him about all of the things that she wanted to know.~!~(NP the[Pre-Nominal] queen (NP of Sheba ) ) (VP arriv+ed[Past_Tense] ) (NP in in Jerusalem ) [ and (NP ) (VP brought ) (NP (NP a[Pre-Nominal] (AdjP very[Pre-Adjective] big ) group of ) servant+s[Plural] ) ] . (NP (NP _ the[Pre-Nominal] queen+`s[Saxon_Genitive] ) camel+s[Plural] ) (VP were[Pre-Verbal] carry+ing[Participle] ) (NP seed+s[Plural] [ that[Relativizer] (NP people ) (VP put ) (NP ) (NP in food ) [ so_that (NP it ) (VP would[Pre-Verbal] taste ) (AdjP good ) ] ] , ) (NP (NP (AdjP very[Pre-Adjective] big ) amount+s[Plural] of ) gold , ) (NP and (AdjP valuable ) gem+s[Plural] ) . (NP the[Pre-Nominal] queen ) (VP came ) (NP to Solomon ) [ and (NP ) (VP ask+ed[Past_Tense] ) (NP him (NP (AdjP about ) (AdjP all of ) the[Pre-Nominal] thing+s[Plural] [ that[Relativizer] (NP she ) (VP want+ed[Past_Tense] ) [ (NP ) (VP to[Pre-Verbal] know ) (NP ) ] ] ) ) ] . ",,,
365,1 Kings 10:3,Solomon answered all of the queen's questions. No question was too difficult. Solomon was able to explain all things to the queen.Solomon answered all of the queen's questions. No question was too difficult. Solomon was able to explain all things to the queen.~!~(NP Solomon ) (VP answer+ed[Past_Tense] ) (NP (AdjP all of ) (NP _ the[Pre-Nominal] queen+`s[Saxon_Genitive] ) question+s[Plural] ) . (NP no[Pre-Nominal] question ) (VP was ) (AdjP too[Pre-Adjective] difficult ) . (NP Solomon ) (VP was ) (AdjP able [ (NP ) (VP to[Pre-Verbal] explain ) (NP (AdjP all ) thing+s[Plural] ) (NP to the[Pre-Nominal] queen ) ] ) . ,,,
366,1 Kings 10:4,So the queen of Sheba saw that Solomon was very wise. She saw the palace that Solomon had built.So the queen of Sheba saw that Solomon was very wise. She saw the king's house that Solomon had built.~!~so (NP the[Pre-Nominal] queen (NP of Sheba ) ) (VP saw ) [ that[Complementizer] (NP Solomon ) (VP was ) (AdjP very[Pre-Adjective] wise ) ] . (NP she ) (VP saw ) (NP (NP _ the[Pre-Nominal] king+`s[Saxon_Genitive] ) house [ that[Relativizer] (NP Solomon ) (VP had[Pre-Verbal] built ) (NP ) ] ) . ,,,
