ID,Reference,Verse,Notes,NoteFonts,Residue
122,1 Kings 3:23,"Then the king said, “This woman says, “My son is alive. Your son is dead.” But the other woman says, “No! Your son is dead. My son is alive.”Then the king said, “This woman says, “My son is alive. Your son is dead.” But the other woman says, “No! Your son is dead. My son is alive.””~!~then (NP the[Pre-Nominal] king ) (VP said ) [ ,_“ (NP this[Pre-Nominal] woman ) (VP says ) [ ,_“ (NP (NP _ my ) son ) (VP is ) (AdjP alive ) ] ] . (NP (NP _ your ) son ) (VP is ) (AdjP dead ) . ” but (NP the[Pre-Nominal] (AdjP other ) woman ) (VP says ) [ ,_“ no ! ] . (NP (NP _ your ) son ) (VP is ) (AdjP dead ) . (NP (NP _ my ) son ) (VP is ) (AdjP alive ) . ” ” ",,,
123,1 Kings 3:24,"And the king said, “Bring a sword to me.” So the king's servants brought a sword to him.And the king said, “Bring a sword to me.” So the king's servants brought a sword to him.~!~and (NP the[Pre-Nominal] king ) (VP said ) [ ,_“ (NP ) (VP bring ) (NP a[Pre-Nominal] sword ) (NP to me ) ” ] . so (NP (NP _ the[Pre-Nominal] king+`s[Saxon_Genitive] ) servant+s[Plural] ) (VP brought ) (NP a[Pre-Nominal] sword ) (NP to him ) . ",,,
124,1 Kings 3:25,"Then the king said, “Cut the alive baby into two pieces and give a piece of him to each woman.”Then the king said, “Cut the living baby into two pieces and give a piece of him to each woman.”~!~then (NP the[Pre-Nominal] king ) (VP said ) [ ,_“ (NP ) (VP cut ) (NP the[Pre-Nominal] (AdjP living ) baby ) (NP into (AdjP two ) piece+s[Plural] ) ] [ and (NP ) (VP give ) (NP a[Pre-Nominal] piece (NP of him ) ) (NP to (AdjP each ) woman ) ” ] . ",,,
126,1 Kings 3:27,"Then the king said, “Don't kill the alive child. Give that child to the first woman. That woman is the child's mother.”Then the king said, “Don't kill the living child. Give that child to the first woman. That woman is the child's mother.”~!~then (NP the[Pre-Nominal] king ) (VP said ) [ ,_“ (NP ) (VP don`t[Pre-Verbal] kill ) (NP the[Pre-Nominal] (AdjP living ) child ) ] . (NP ) (VP give ) (NP that[Pre-Nominal] child ) (NP to the[Pre-Nominal] (AdjP first ) woman ) . (NP that[Pre-Nominal] woman ) (VP is ) (NP (NP _ the[Pre-Nominal] child+`s[Saxon_Genitive] ) mother ) . ” ",,,
127,1 Kings 3:28,All of Israel's people heard that the king had judged for that woman fairly. So they respected a lot the king. Then they knew that God caused the king to be wise. And they knew that the king was able to judge them fairly.All of Israel's people heard that the king had judged for that woman fairly. So they respected highly the king. Then they knew that God caused the king to be wise. And they knew that the king was able to judge them fairly.~!~(NP (AdjP all of ) (NP _ Israel+`s[Saxon_Genitive] ) people ) (VP heard ) [ that[Complementizer] (NP the[Pre-Nominal] king ) (VP had[Pre-Verbal] judg+ed[Past_Tense] ) (NP for that[Pre-Nominal] woman ) (AdvP fairly ) ] . so (NP they ) (VP respect+ed[Past_Tense] (AdvP highly ) ) (NP the[Pre-Nominal] king ) . then (NP they ) (VP knew ) [ that[Complementizer] (NP God ) (VP caus+ed[Past_Tense] ) (NP the[Pre-Nominal] king ) [ (NP ) (VP to[Pre-Verbal] be ) (AdjP wise ) ] ] . and (NP they ) (VP knew ) [ that[Complementizer] (NP the[Pre-Nominal] king ) (VP was ) (AdjP able [ (NP ) (VP to[Pre-Verbal] judge ) (NP them ) (AdvP fairly ) ] ) ] . ,,,
128,1 Kings 4:1,Title: These men are Solomon's officials. So King Solomon ruled the whole nation of Israel.Title: These men are Solomon's officials. So King Solomon ruled the whole nation of Israel.~!~Title:[Proposition_Label] (NP these[Pre-Nominal] men ) (VP are ) (NP (NP _ Solomon+`s[Saxon_Genitive] ) official+s[Plural] ) . so (NP (NP _ King ) Solomon ) (VP rul+ed[Past_Tense] ) (NP the[Pre-Nominal] (AdjP whole ) nation (NP of Israel ) ) . ,,,
129,1 Kings 4:2,These names are the names Solomon's most important officials. Azariah was the priest. Azariah was Zadok's son.These names are the names of Solomon's most important officials. Azariah was the priest. Azariah was Zadok's son.~!~(NP these[Pre-Nominal] name+s[Plural] ) (VP are ) (NP the[Pre-Nominal] name+s[Plural] (NP of _ (NP _ Solomon+`s[Saxon_Genitive] ) (AdjP most[Degree] important ) official+s[Plural] ) ) . (NP Azariah ) (VP was ) (NP the[Pre-Nominal] priest ) . (NP Azariah ) (VP was ) (NP (NP _ Zadok+`s[Saxon_Genitive] ) son ) . ,,,
130,1 Kings 4:3,"Elihoreph and Ahijah were the king's secretaries. They were Shisha's sons. Jehoshaphat listened to the king and told the people the things that he said. Jehoshaphat was Ahilud's son.Elihoreph and Ahijah were the king's secretaries. They were Shisha's sons. Jehoshaphat listened to the king and told the people the things that he said. Jehoshaphat was Ahilud's son.~!~(NP Elihoreph ) (NP and Ahijah ) (VP were ) (NP (NP _ the[Pre-Nominal] king+`s[Saxon_Genitive] ) secretari+es[Plural] ) . (NP they ) (NP ) (VP were ) (NP (NP _ Shisha+`s[Saxon_Genitive] ) son+s[Plural] ) . (NP Jehoshaphat ) (VP listened ) (NP to the[Pre-Nominal] king ) [ and (NP ) (VP told ) (NP the[Pre-Nominal] people ) [ (NP the[Pre-Nominal] thing+s[Plural] [ that[Relativizer] (NP he ) (VP said ) (NP ) ] , ) ] ] . (NP Jehoshaphat ) (VP was ) (NP (NP _ Ahilud+`s[Saxon_Genitive] ) son ) . ",,,
131,1 Kings 4:4,Benaiah was the leader of the army. Benaiah was Jehoiada's son. Zadok and Abiathar were priests.Benaiah was the leader of the army. Benaiah was Jehoiada's son. Zadok and Abiathar were priests.~!~(NP Benaiah ) (VP was ) (NP the[Pre-Nominal] leader (NP of the[Pre-Nominal] army ) ) . (NP Benaiah ) (VP was ) (NP (NP _ Jehoiada+`s[Saxon_Genitive] ) son ) . (NP Zadok ) (NP and Abiathar ) (VP were ) (NP priest+s[Plural] ) . ,,,
132,1 Kings 4:5,Azariah oversaw the people who governed parts of Israel. He was Nathan's son. Zabud was a priest and also advised the king. Zabud was Nathan's son.Azariah oversaw the people who governed parts of Israel. He was Nathan's son. Zabud was a priest and also advised the king. Zabud was Nathan's son.~!~(NP Azariah ) (VP oversaw ) (NP the[Pre-Nominal] people [ who[Relativizer] (NP ) (VP govern+ed[Past_Tense] ) (NP part+s[Plural] (NP of Israel ) ) ] ) . (NP he ) (VP was ) (NP (NP _ Nathan+`s[Saxon_Genitive] ) son ) . (NP Zabud ) (VP was ) (NP a[Pre-Nominal] priest ) [ and (NP ) (VP (AdvP also ) advis+ed[Past_Tense] ) (NP the[Pre-Nominal] king ) ] . (NP Zabud ) (VP was ) (NP (NP _ Nathan+`s[Saxon_Genitive] ) son ) . ,,,
133,1 Kings 4:6,Ahishar oversaw the king's palace. Adoniram oversaw the people that the king's soldiers forced to work for him. He was Abda's son.Ahishar oversaw the king's palace. Adoniram oversaw the people that the king's soldiers forced to work for him. He was Abda's son.~!~(NP Ahishar ) (VP oversaw ) (NP (NP _ the[Pre-Nominal] king+`s[Saxon_Genitive] ) palace ) . (NP Adoniram ) (VP oversaw ) (NP the[Pre-Nominal] people [ that[Relativizer] (NP (NP _ the[Pre-Nominal] king+`s[Saxon_Genitive] ) soldier+s[Plural] ) (VP forc+ed[Past_Tense] ) (NP ) [ (NP ) (VP to[Pre-Verbal] work ) (NP for him ) ] ] ) . (NP he ) (VP was ) (NP (NP _ Abda+`s[Saxon_Genitive] ) son ) . ,,,
134,1 Kings 4:7,Solomon had twelve governors who governed all of Israel. The governors gathered food the king and the royal family. Each governor had to gather enough food for one month of each year.Solomon had twelve governors who governed all of Israel. The governors gathered food for the king and the royal family. Each governor had to gather enough food for one month of each year.~!~(NP Solomon ) (VP had ) (NP (AdjP twelve ) governor+s[Plural] [ who[Relativizer] (NP ) (VP govern+ed[Past_Tense] ) (NP (AdjP all of ) Israel ) ] ) . (NP the[Pre-Nominal] governor+s[Plural] ) (VP gathered ) (NP food ) (NP for the[Pre-Nominal] king ) (NP and the[Pre-Nominal] (AdjP royal ) family ) . (NP (AdjP each ) governor ) (VP had_to[Pre-Verbal] gather ) (NP (AdjP enough ) food ) (NP for (AdjP one ) month (NP of (AdjP each ) year ) ) . ,,,
135,1 Kings 4:8,These names are the rulers names and the names of the places where they governed people. Ben-Hur governed the people who lived in the hills of the tribe of Ephraim.These names are the governors names and the names of the places where they governed people. Ben-Hur governed the people who lived in the hills of the tribe of Ephraim.~!~(NP these[Pre-Nominal] name+s[Plural] ) (VP are ) (NP (NP _ the[Pre-Nominal] governor+s[Plural] ) name+s[Plural] (NP and the[Pre-Nominal] name+s[Plural] (NP of _ the[Pre-Nominal] place+s[Plural] [ where[Relativizer] (NP they ) (VP govern+ed[Past_Tense] ) (NP people ) (NP ) ] ) ) ) . (NP Ben-Hur ) (VP govern+ed[Past_Tense] ) (NP the[Pre-Nominal] people [ who[Relativizer] (NP ) (VP liv+ed[Past_Tense] ) (NP in the[Pre-Nominal] hill+s[Plural] (NP of _ the[Pre-Nominal] tribe (NP of Ephraim ) ) ) ] ) . ,,,
136,1 Kings 4:9,"Ben-Deker governed the people who lived in Makaz, Shaalbim, Beth-Shemesh, and Elon-Bethhanan.Ben-Deker governed the people who lived in Makaz, Shaalbim, Beth-Shemesh, and Elon-Bethhanan.~!~(NP Ben-Deker ) (VP govern+ed[Past_Tense] ) (NP the[Pre-Nominal] people [ who[Relativizer] (NP ) (VP liv+ed[Past_Tense] ) (NP in Makaz , ) (NP Shaalbim , ) (NP Beth-Shemesh , ) (NP and Elon-Bethhanan ) ] ) . ",,,
137,1 Kings 4:10,"Ben-Hesed governed the people who lived in Arubboth, Sokoh, and all of the land of Hepher.Ben-Hesed governed the people who lived in Arubboth, Sokoh, and all of Hepher's land.~!~(NP Ben-Hesed ) (VP govern+ed[Past_Tense] ) (NP the[Pre-Nominal] people [ who[Relativizer] (NP ) (VP liv+ed[Past_Tense] ) (NP in Arubboth , ) (NP Sokoh , ) (NP and (AdjP all of ) (NP _ Hepher+`s[Saxon_Genitive] ) land ) ] ) . ",,,
138,1 Kings 4:11,Ben-Abinadab governed the people who lived in Naphoth-Dor. He married Taphath who was Solomon's daughter.Ben-Abinadab governed the people who lived in Naphoth Dor. He married Taphath who was Solomon's daughter.~!~(NP Ben-Abinadab ) (VP govern+ed[Past_Tense] ) (NP the[Pre-Nominal] people [ who[Relativizer] (NP ) (VP liv+ed[Past_Tense] ) (NP in Naphoth_Dor ) ] ) . (NP he ) (VP marr+ied[Past_Tense] ) (NP Taphath [ who[Relativizer] (NP ) (VP was ) (NP (NP _ Solomon+`s[Saxon_Genitive] ) daughter ) ] ) . ,,,
139,1 Kings 4:12,"Baana governed Taanach, Megiddo, and all of the land of Beth-Shan. Beth-Shan was beside Zarethan and below Jezreel. Baana governed the land that was between Beth-Shan, Abel-Meholah, and Jokmeam. He was Ahilud's son.Baana governed Taanach, Megiddo, and all of the land of Beth-Shan. Beth-Shan was beside Zarethan and below Jezreel. Baana governed the land that was between Beth-Shan, Abel-Meholah, and Jokmeam. He was Ahilud's son.~!~(NP Baana ) (VP govern+ed[Past_Tense] ) (NP Taanach , ) (NP Megiddo , ) (NP and (AdjP all of ) the[Pre-Nominal] land (NP of Beth-Shan ) ) . (NP Beth-Shan ) (VP was ) (NP beside Zarethan ) (NP and below Jezreel ) . (NP Baana ) (VP govern+ed[Past_Tense] ) (NP the[Pre-Nominal] land [ that[Relativizer] (NP ) (VP was ) (NP between Beth-Shan , ) (NP Abel-Meholah , ) (NP and Jokmeam ) ] ) . (NP he ) (VP was ) (NP (NP _ Ahilud+`s[Saxon_Genitive] ) son ) . ",,,
140,1 Kings 4:13,Ben-Geber governed the people who lived in Ramoth that was in Gilead. This region included the villages of Jair who was Manasseh's son. Ben-Geber also governed the people who lived in the land of Argob that was in Bashan. Argob had 60 big towns that had high walls and strong gates. People used lock those gates bronze poles.~!~(NP Ben-Geber ) (VP govern+ed[Past_Tense] ) (NP the[Pre-Nominal] people [ who[Relativizer] (NP ) (VP liv+ed[Past_Tense] ) (NP in Ramoth [ that[Relativizer] (NP ) (VP was ) (NP in Gilead ) ] ) ] ) . (NP this[Pre-Nominal] region ) (VP includ+ed[Past_Tense] ) (NP the[Pre-Nominal] village+s[Plural] (NP of Jair [ who[Relativizer] (NP ) (VP was ) (NP (NP _ Manasseh+`s[Saxon_Genitive] ) son ) ] ) ) . (NP Ben-Geber ) (VP (AdvP also ) govern+ed[Past_Tense] ) (NP the[Pre-Nominal] people [ who[Relativizer] (NP ) (VP liv+ed[Past_Tense] ) (NP in the[Pre-Nominal] land (NP of _ Argob [ that[Relativizer] (NP ) (VP was ) (NP in Bashan ) ] ) ) ] ) . (NP Argob ) (VP had ) (NP (AdjP 60 ) (AdjP big ) town+s[Plural] [ that[Relativizer] (NP ) (VP had ) (NP (AdjP high ) wall+s[Plural] ) (NP and (AdjP strong ) gate+s[Plural] ) ] ) . (NP people ) (VP us+ed[Past_Tense] ) (VP lock ) (NP those[Pre-Nominal] gate+s[Plural] ) (NP (NP _ bronze ) pole+s[Plural] ) . ,,,
141,1 Kings 4:14,Ahinadab governed the people who lived in Mahanaim. He was Iddo's son.Ahinadab governed the people who lived in Mahanaim. He was Iddo's son.~!~(NP Ahinadab ) (VP govern+ed[Past_Tense] ) (NP the[Pre-Nominal] people [ who[Relativizer] (NP ) (VP liv+ed[Past_Tense] ) (NP in Mahanaim ) ] ) . (NP he ) (VP was ) (NP (NP _ Iddo+`s[Saxon_Genitive] ) son ) . ,,,
142,1 Kings 4:15,Ahimaaz governed the people who lived in the region of the tribe of Naphtali. He married Basemath who was Solomon's daughter.Ahimaaz governed the people who lived in the region of the tribe of Naphtali. He married Basemath who was Solomon's daughter.~!~(NP Ahimaaz ) (VP govern+ed[Past_Tense] ) (NP the[Pre-Nominal] people [ who[Relativizer] (NP ) (VP liv+ed[Past_Tense] ) (NP in the[Pre-Nominal] region (NP of _ the[Pre-Nominal] tribe (NP of Naphtali ) ) ) ] ) . (NP he ) (VP marr+ied[Past_Tense] ) (NP Basemath [ who[Relativizer] (NP ) (VP was ) (NP (NP _ Solomon+`s[Saxon_Genitive] ) daughter ) ] ) . ,,,
143,1 Kings 4:16,Baana governed the people who lived in the region of the tribe of Asher and Aloth. He was Hushai's son.Baana governed the people who lived in the region of the tribe of Asher and Aloth. He was Hushai's son.~!~(NP Baana ) (VP govern+ed[Past_Tense] ) (NP the[Pre-Nominal] people [ who[Relativizer] (NP ) (VP liv+ed[Past_Tense] ) (NP in the[Pre-Nominal] region (NP of _ the[Pre-Nominal] tribe (NP of Asher ) ) ) (NP and Aloth ) ] ) . (NP he ) (VP was ) (NP (NP _ Hushai+`s[Saxon_Genitive] ) son ) . ,,,
144,1 Kings 4:17,Jehoshaphat governed the people who lived in region of the tribe of Issachar. He was Paruah's son.Jehoshaphat governed the people who lived in region of the tribe of Issachar. He was Paruah's son.~!~(NP Jehoshaphat ) (VP govern+ed[Past_Tense] ) (NP the[Pre-Nominal] people [ who[Relativizer] (NP ) (VP liv+ed[Past_Tense] ) (NP in region (NP of _ the[Pre-Nominal] tribe (NP of Issachar ) ) ) ] ) . (NP he ) (VP was ) (NP (NP _ Paruah+`s[Saxon_Genitive] ) son ) . ,,,
145,1 Kings 4:18,Shimei governed the people who lived in the region of the tribe of Benjamin. He was Ela's son.Shimei governed the people who lived in the region of the tribe of Benjamin. He was Ela's son.~!~(NP Shimei ) (VP govern+ed[Past_Tense] ) (NP the[Pre-Nominal] people [ who[Relativizer] (NP ) (VP liv+ed[Past_Tense] ) (NP in the[Pre-Nominal] region (NP of _ the[Pre-Nominal] tribe (NP of Benjamin ) ) ) ] ) . (NP he ) (VP was ) (NP (NP _ Ela+`s[Saxon_Genitive] ) son ) . ,,,
146,1 Kings 4:19,Geber governed the people who lived in Gilead. Gilead was the country of Sihon who was king of the Amorites and of Og who was king of Bashan. Geber was Uri's son. And there was one governor who governed all of the land.Geber governed the people who lived in Gilead. Gilead was the country of Sihon who was king of the Amorites and of Og who was king of Bashan. Geber was Uri's son. And there was one governor who governed all of the land.~!~(NP Geber ) (VP govern+ed[Past_Tense] ) (NP the[Pre-Nominal] people [ who[Relativizer] (NP ) (VP liv+ed[Past_Tense] ) (NP in Gilead ) ] ) . (NP Gilead ) (VP was ) (NP the[Pre-Nominal] country (NP of _ Sihon [ who[Relativizer] (NP ) (VP was ) (NP king (NP of the[Pre-Nominal] Amorite+s[Plural] ) ) ] ) (NP and of _ Og [ who[Relativizer] (NP ) (VP was ) (NP king (NP of Bashan ) ) ] ) ) . (NP Geber ) (VP was ) (NP (NP _ Uri+`s[Saxon_Genitive] ) son ) . and (NP there[Existential_Expletive] ) (VP (VP was ) ) (NP (AdjP one ) governor [ who[Relativizer] (NP ) (VP govern+ed[Past_Tense] ) (NP (AdjP all of ) the[Pre-Nominal] land ) ] ) . ,,,
147,1 Kings 4:20,Title: Solomon's kingdom has great wealth. The number of the people who were in Israel and Judah was like the number of the grains of sand that are near the sea. The people ate and drank. And they were happy.Title: Solomon's kingdom has great wealth. The number of the people who were in Israel and Judah was like the number of the grains of sand that are near the sea. The people ate and drank. And they were happy.~!~Title:[Proposition_Label] (NP (NP _ Solomon+`s[Saxon_Genitive] ) kingdom ) (VP has ) (NP (AdjP great ) wealth ) . (NP the[Pre-Nominal] number (NP of the[Pre-Nominal] people [ who[Relativizer] (NP ) (VP were ) (NP in Israel (NP and Judah ) ) ] ) ) (VP was ) (NP like the[Pre-Nominal] number (NP of the[Pre-Nominal] grain+s[Plural] (NP of sand ) [ that[Relativizer] (NP ) (VP are ) (NP near the[Pre-Nominal] sea ) ] ) ) . (NP the[Pre-Nominal] people ) (VP ate ) [ and (NP ) (VP drank ) ] . and (NP they ) (VP were ) (AdjP happy ) . ,,,
148,1 Kings 4:21,"Solomon ruled all of the nations that were between the Euphrates river, the land of the Philistines, and the border of Egypt. All of those nations brought the gifts that Solomon demanded that they bring to him. And Solomon ruled those nations for all of the days he was alive.Solomon ruled all of the kingdoms that were between the Euphrates River, the Philistines' land, and the border of Egypt. All of those kingdoms brought the gifts that Solomon demanded that they bring to him. And Solomon ruled those kingdoms for all of the days he was alive.~!~(NP Solomon ) (VP rul+ed[Past_Tense] ) (NP (AdjP all of ) the[Pre-Nominal] kingdom+s[Plural] [ that[Relativizer] (NP ) (VP were ) (NP between the[Pre-Nominal] Euphrates[First_Word_of_Compound_Noun] River , ) (NP (NP _ the[Pre-Nominal] Philistine+s[Plural]+~[Saxon_Genitive] ) land , ) (NP and the[Pre-Nominal] border (NP of Egypt ) ) ] ) . (NP (AdjP all of ) those[Pre-Nominal] kingdom+s[Plural] ) (VP brought ) (NP the[Pre-Nominal] gift+s[Plural] [ that[Relativizer] (NP Solomon ) (VP demand+ed[Past_Tense] ) [ that[Complementizer] (NP they ) (VP bring ) (NP ) (NP to him ) ] ] ) . and (NP Solomon ) (VP rul+ed[Past_Tense] ) (NP those[Pre-Nominal] kingdom+s[Plural] ) (NP for (AdjP all of ) the[Pre-Nominal] days [ (NP he ) (VP was ) (AdjP alive ) ] ) . ",,,
149,1 Kings 4:22,"Each day, Solomon needed these things. He needed 6500 quarts of flour that people made from the inner part of wheat and 13000 quarts of other flourEach day, Solomon needed these things. He needed of flour that people made from the inner part of wheat and of other flour.~!~(NP (AdjP each ) day , ) (NP Solomon ) (VP need+ed[Past_Tense] ) (NP these[Pre-Nominal] thing+s[Plural] ) . (NP he ) (VP need+ed[Past_Tense] ) (NP (NP (AdjP ) of ) flour [ that[Relativizer] (NP people ) (VP made ) (NP ) (NP from the[Pre-Nominal] (AdjP inner ) part (NP of wheat ) ) ] ) (NP and (NP (AdjP ) of ) (AdjP other ) flour ) . ",,,
150,1 Kings 4:23,"Solomon needed ten cows that people fed with grain, twenty cows that ate grass in the fields, one hundred other animals that included sheep and goats, three kinds of deer, and the best birds.Solomon needed ten cows that people fed with grain, twenty cows that ate grass in the fields, one hundred other animals that included sheep and goats, three kinds of deer, and the best birds.~!~(NP Solomon ) (VP need+ed[Past_Tense] ) (NP (AdjP ten ) cow+s[Plural] [ that[Relativizer] (NP people ) (VP fed ) (NP ) (NP with grain ) ] , ) (NP (AdjP twenty ) cow+s[Plural] [ that[Relativizer] (NP ) (VP ate ) (NP grass ) (NP in the[Pre-Nominal] field+s[Plural] ) ] , ) (NP (AdjP one_hundred ) (AdjP other ) animal+s[Plural] [ that[Relativizer] (NP ) (VP includ+ed[Past_Tense] ) (NP sheep ) (NP and goat+s[Plural] ) ] , ) (NP (NP (AdjP three ) kind+s[Plural] of ) deer , ) (NP and the[Pre-Nominal] (AdjP best ) bird+s[Plural] ) . ",,,
151,1 Kings 4:24,Solomon ruled all of the kingdoms that were west of the Euphrates river. He ruled all of the land that was between Tiphsah and Gaza. And he had peace with all of the nations that were around him.Solomon ruled all of the kingdoms that were on western side of the Euphrates River. He ruled all of the land that was between Tiphsah and Gaza. And he had peace with all of the nations that were around him.~!~(NP Solomon ) (VP rul+ed[Past_Tense] ) (NP (AdjP all of ) the[Pre-Nominal] kingdom+s[Plural] [ that[Relativizer] (NP ) (VP were ) (NP on (AdjP western ) side (NP of the[Pre-Nominal] Euphrates[First_Word_of_Compound_Noun] River ) ) ] ) . (NP he ) (VP rul+ed[Past_Tense] ) (NP (AdjP all of ) the[Pre-Nominal] land [ that[Relativizer] (NP ) (VP was ) (NP between Tiphsah (NP and Gaza ) ) ] ) . and (NP he ) (VP had ) (NP peace ) (NP with (AdjP all of ) the[Pre-Nominal] nation+s[Plural] [ that[Relativizer] (NP ) (VP were ) (NP around him ) ] ) . ,,,
152,1 Kings 4:25,"Judah and Israel were safe while Solomon was king. They were strong in all of the land that was between Dan and Beersheba. Each person had a vine and a fig tree for himself.Judah and Israel were safe while Solomon was king. They were strong in all of the land that was between Dan and Beersheba. Each person had a vine and a fig tree for himself.~!~(NP Judah ) (NP and Israel ) (VP were ) (AdjP safe ) [ while (NP Solomon ) (VP was ) (NP king ) ] . (NP they ) (NP ) (VP were ) (AdjP strong [ (NP in (AdjP all of ) the[Pre-Nominal] land [ that[Relativizer] (NP ) (VP was ) (NP between Dan (NP and Beersheba ) ) ] , ) ] ) . (NP (AdjP each ) person ) (VP had ) (NP a[Pre-Nominal] vine ) (NP and a[Pre-Nominal] fig[First_Word_of_Compound_Noun] tree ) (NP for himself ) . ",,,
153,1 Kings 4:26,"Solomon had 4,000 places where he kept horses who pulled his chariots. The number of all of Solomon's horses was 12,000.Solomon had 4,000 places where he kept horses who pulled his chariots. The number of all of Solomon's horses was 12,000.~!~(NP Solomon ) (VP had ) (NP (AdjP 4,000 ) place+s[Plural] [ where[Relativizer] (NP he ) (VP kept ) (NP ) (NP horse+s[Plural] [ who[Relativizer] (NP ) (VP pull+ed[Past_Tense] ) (NP (NP _ his ) chariot+s[Plural] ) ] ) ] ) . (NP the[Pre-Nominal] number (NP of (NP _ (AdjP all of ) Solomon+`s[Saxon_Genitive] ) horse+s[Plural] ) ) (VP was ) (AdjP 12,000 ) . ",,,
154,1 Kings 4:27,The governors gathered food King Solomon. They gave food to Solomon for all of people who ate at the king's table. Each governor gave enough food to Solomon for one month of each year. The governors faithfully gave the king each thing that he needed.The governors gathered food for King Solomon. They gave food to Solomon for all of people who ate at the king's table. Each governor gave enough food to Solomon for one month of each year. The governors faithfully gave the king each thing that he needed.~!~(NP the[Pre-Nominal] governor+s[Plural] ) (VP gathered ) (NP food ) (NP for (NP _ King ) Solomon ) . (NP they ) (VP gave ) (NP food ) (NP to Solomon ) (NP for (AdjP all of ) people [ who[Relativizer] (NP ) (VP ate ) (NP at (NP _ the[Pre-Nominal] king+`s[Saxon_Genitive] ) table ) ] ) . (NP (AdjP each ) governor ) (VP gave ) (NP (AdjP enough ) food ) (NP to Solomon ) (NP for (AdjP one ) month (NP of (AdjP each ) year ) ) . (NP the[Pre-Nominal] governor+s[Plural] ) (VP (AdvP faithfully ) gave ) (NP the[Pre-Nominal] king ) (NP (AdjP each ) thing [ that[Relativizer] (NP he ) (VP need+ed[Past_Tense] ) (NP ) ] ) . ,,,
155,1 Kings 4:28,The people who worked for the governors also brought barley and straw for the horses who pulled chariots and the other horses. They brought the amount of barley that Solomon told the governors to bring and the amount of straw that he told them to bring to the places where they should be.The people who worked for the governors also brought barley and straw for the horses who pulled chariots and the other horses. They brought the amount of barley that Solomon told the governors to bring and the amount of straw that he told them to bring to the places where they should be.~!~(NP the[Pre-Nominal] people [ who[Relativizer] (NP ) (VP work+ed[Past_Tense] ) (NP for the[Pre-Nominal] governor+s[Plural] ) ] ) (VP (AdvP also ) brought ) (NP barley ) (NP and straw ) (NP for the[Pre-Nominal] horse+s[Plural] [ who[Relativizer] (NP ) (VP pull+ed[Past_Tense] ) (NP chariot+s[Plural] ) ] ) (NP and the[Pre-Nominal] (AdjP other ) horse+s[Plural] ) . (NP they ) (VP brought ) (NP the[Pre-Nominal] amount (NP of barley [ that[Relativizer] (NP Solomon ) (VP told ) (NP the[Pre-Nominal] governor+s[Plural] ) [ (NP ) (VP to[Pre-Verbal] bring ) (NP ) ] ] ) ) (NP and the[Pre-Nominal] amount (NP of straw [ that[Relativizer] (NP he ) (VP told ) (NP them ) [ (NP ) (VP to[Pre-Verbal] bring ) (NP ) ] ] ) ) (NP to the[Pre-Nominal] place+s[Plural] [ where[Relativizer] (NP they ) (VP should[Pre-Verbal] be ) (NP ) ] ) . ,,,
156,1 Kings 4:29,God caused Solomon to be very wise. And God caused Solomon to understand many things. The number things that Solomon understood was like the number of the grains of sand that are near the sea.God caused Solomon to be very wise. And God caused Solomon to understand many things. The number of things that Solomon understood was like the number of the grains of sand that are near the sea.~!~(NP God ) (VP caus+ed[Past_Tense] ) (NP Solomon ) [ (NP ) (VP to[Pre-Verbal] be ) (AdjP very[Pre-Adjective] wise ) ] . and (NP God ) (VP caus+ed[Past_Tense] ) (NP Solomon ) [ (NP ) (VP to[Pre-Verbal] understand ) (NP (AdjP many ) thing+s[Plural] ) ] . (NP the[Pre-Nominal] number (NP of thing+s[Plural] [ that[Relativizer] (NP Solomon ) (VP understood ) (NP ) ] ) ) (VP was ) (NP like the[Pre-Nominal] number (NP of the[Pre-Nominal] grain+s[Plural] (NP of sand ) [ that[Relativizer] (NP ) (VP are ) (NP near the[Pre-Nominal] sea ) ] ) ) . ,,,
